title,company_name_reworked,website,phone,city,category,abstract,ai_first_sentence
Plynospotrebiče,Plynospotrebiče,,,Kolárovo,Predajňa domácich potrieb,,
PLYNAR Bratislava,PLYNAR Bratislava,https://www.plynarbratislava.sk/,+421 949 693 513,Bratislava,Plynoinštalatér,"PLYNAR Bratislava je profesionálna firma zameraná na opravy a montáže plynových zariadení. Ponúkame široké spektrum služieb, vrátane montáže a výmeny plynových kotlov, opravy plynových potrubí a havarijnej služby. Našou prioritou je poskytovanie kvalitných služieb zákazníkom v Bratislave a okolí. Naša odborná skupina zabezpečuje rýchly a efektívny priebeh všetkých projektov.","Dobrý deň. Páči sa mi, že v PLYNAR Bratislava sa venujete komplexnému riešeniu plynových zariadení a ponúkate široké spektrum služieb, čím sa staráte o bezpečnosť a komfort svojich zákazníkov."
Plynar Bratislava - KRAJČÍR Róbert,Plynar Bratislava,http://ba-plynar.sk/,+421 907 811 872,Petržalka,Plynoinštalatér,"Plynár Bratislava sa špecializuje na montáž, servis a revíziu plynových zariadení pre domácnosti a firmy v Bratislave a okolí. S dlhoročnými skúsenosťami a dôrazom na bezpečnosť a precíznosť poskytujú odborné služby, ktoré zabezpečujú spoľahlivosť plynových systémov.","Dobrý deň. Páči sa mi, že v Plynár Bratislava sa venujete poskytovaniu kvalitných plynových služieb s dôrazom na bezpečnosť a odbornú precíznosť, čo je v tejto oblasti mimoriadne dôležité."
"JN PLYN, s.r.o.",JN,https://www.jnplyn.sk/,+421 903 458 049,Košice,Kúrenárske práce,"Spoločnosť JN PLYN s.r.o. sa špecializuje na predaj, opravu a servis plynových kotlov s cieľom ponúknuť praktické riešenia pre inteligentné vykurovanie. Naša firma sa zameriava na poskytovanie kvalitných služieb v oblasti údržby a opráv plynových kotlov, pričom sa snažíme šetriť náklady a životné prostredie. Zabezpečujeme zmluvný servis pre renomované značky ako Junkers, Motan a Viessmann, pričom ponúkame aj opravy starších kotlov ako Destila a Leiber.","Dobrý deň. Páči sa mi, že v JN PLYN s.r.o. sa venujete komplexným riešeniam v oblasti vykurovania, pričom dbáte na kvalitu a efektivitu vašich služieb."
"PLYNOSERVIS Humenné, s. r. o.",PLYNOSERVIS Humenné,http://www.plynoservishe.sk/,+421 905 506 490,Humenné,Veľkoobchod,"Spoločnosť PLYNOSERVIS Humenné sa špecializuje na predaj a servis tepelných čerpadiel, kotlov a klimatizácií. Naša firma sa zameriava na poskytovanie kvalitných a efektívnych riešení v oblasti vykurovania a chladenia, pričom dbáme na profesionálny prístup a zákaznícky servis.  V minulosti sme úspešne zrealizovali množstvo projektov, čím sme si vybudovali dobré meno v našom odbore. Naším cieľom je poskytovať našim klientom komplexné služby, ktoré zvýšia ich komfort a efektívnosť energetických systémov.","Dobrý deň. Páči sa mi, že v PLYNOSERVIS Humenné sa venujete poskytovaniu komplexných riešení v oblasti vykurovania a chladenia. Váš prístup k zákazníkom a dôraz na kvalitu služieb sú pre mňa veľmi inšpirujúce."
ANDREJ REPASKÝ servis plynových kotlov,ANDREJ REPASKÝ servis plynových kotlov,,+421 917 409 984,Golianovo,Dodávateľ zariadení pre kúrenárov,,
Plynko.sk,Plynko,https://plynko.sk/,+421 905 384 384,Martin,Plynoinštalatér,"Plynko je odborná inštalácia plynových a elektrických sporákov, ktorá poskytuje kvalitné a bezpečné služby v oblasti inštalácie a údržby. S profesionálnym prístupom garantujeme potvrdenie o záruke a bezplatný odvoz starého spotrebiča na recykláciu, čím zabezpečujeme šikovnú pomoc pre každú domácnosť v okolí Martina a Žiliny. Naša firma disponuje osvedčením o odbornej spôsobilosti, čo zaručuje, že všetky práce sú vykonávané v súlade s platnými normami a predpismi.","Dobrý deň. Páči sa mi, že v Plynko sa venujete odbornému prístupu k inštalácii sporákov a plynových kotlov, čo je pre zákazníkov veľmi dôležité. Vaša ponuka bezplatného odvozu starého zariadenia na recykláciu je skutočne odborným krokom, ktorý zvyšuje vašu atraktivitu na trhu."
KVP ENERGO - kúrenie voda plyn solar elektrika,KVP,http://www.kvpenergo.sk/,+421 908 745 562,Prievidza,Kúrenárske práce,"KVP sa špecializuje na moderné a efektívne riešenia v oblastiach vykurovania, vody a energetických systémov. Ich prístup zahŕňa poradenstvo pre domácnosti a verejné budovy, pričom sa zameriavajú na dosiahnutie tepelných úspor a komfortu, bez nutnosti rozsiahlych rekonštrukcií.","Dobrý deň. Páči sa mi, že v KVP sa venujete inovativným riešeniam pre zvýšenie energetickej efektívnosti domácností a verejných budov."
"Inštalatér - Voda, Plyn, Kúrenie, Plynové kotle, Havaríjna služba NONSTOP 24/7",Inštalatér,https://instalater-senec.sk/,+421 949 157 666,Senec,Vodoinštalatér,"Inštalatér Senec poskytuje profesionálne inštalatérske služby v oblasti vodoinštalácií, plynárenstva a kúrenia. S dôrazom na kvalitu a spoľahlivosť zabezpečujú havarijný servis nonstop, pričom pôsobia v Senci a okolí, Bratislave a Trnave. Ich odborný tím ponúka široké spektrum služieb, vrátane montáže a výmeny kotlov, a sú pripravení riešiť aj urgentné situácie rýchlo a efektívne.","Dobrý deň. Páči sa mi, že v Inštalatér sa venujete komplexnému riešeniu inštalatérskych problémov a ponúkate kvalifikované služby s dôrazom na spokojnosť zákazníkov."
Fodor Edmund - Plynoinštalácia,FODOR,,+421 31/551 95 91,Vrakúň,,,
Plynoma spol. s r.o.,Plynoma,https://plynoma.sk/,+421 51/773 24 66,"Solivar, Prešov",Servis vykurovacích zariadení,"Plynoma s.r.o. je spoľahlivá firma so zameraním na dodávku, montáž a servis plynových a vykurovacích zariadení. Služby zahŕňajú inštaláciu plynovodov, ústredného kúrenia, predaj plynových spotrebičov, klimatizácií a solárnych systémov, pričom pokrývajú širokú škálu potrieb domácností, kancelárií a priemyselných objektov v Prešovskom a Košickom kraji. Naša činnosť zahŕňa aj odborné prehliadky, revízie a pozáručný servis, pričom sa sústreďujeme na kvalitu, spoľahlivosť a spokojnosť klientov.","Dobrý deň. Páči sa mi, že v Plynoma sa venujete zodpovednému prístupu k inštalácii a servisu plynových a vykurovacích zariadení, čím zabezpečujete pohodlie a bezpečnosť pre široké spektrum zákazníkov vo vašom regióne."
TPGAS - Servis plynových zariadení,TPGAS,https://tpgas.sk/,+421 949 707 970,"Mokraď, Dolný Kubín",Obchod s plynovými zariadeniami,"Spoločnosť TPGAS sa špecializuje na odborný servis plynových a elektrických kotlov, ako aj solárnych systémov, a to pre domácnosti i firmy. S dôrazom na rýchlosť, profesionalitu a vysokú kvalitu služieb pokrýva svojou činnosťou oblasti Dolného Kubína, Tvrdošína, Námestova, Ružomberka, Martina, Liptovského Mikuláša a Žiliny. Poskytuje široké spektrum služieb, od údržby a diagnostiky kotlov po inštalácie nových zariadení a revízie, čím zabezpečuje bezpečnosť a efektívnosť vykurovacích systémov svojich klientov.","Dobrý deň. Páči sa mi, že v TPGAS sa venujete kvalitnej údržbe a servisu plynových zariadení, čím prispievate k efektívnosti a bezpečnosti vykurovacích systémov vo vašej oblasti."
GAS-HEATING s.r.o,GAS-HEATING,,,,Kúrenárske práce,,
Helia - Inštalatér Kurenar Vodar Plyn,Helia,https://helia.sk/,+421 944 527 693,,Vodoinštalatér,"Spoločnosť Helia sa špecializuje na komplexné inštalatérske služby, ako sú vodoinštalácia, plynoinštalácia, kúrenie a odpadové systémy. Našou prioritou je zabezpečiť vysokú kvalitu, spoľahlivosť a odbornosť vo všetkých ohľadoch, aby sme nielen splnili, ale aj prevýšili očakávania našich klientov.","Dobrý deň. Páči sa mi, že v Helia sa venujete poskytovaniu komplexných inštalatérskych služieb so zameraním na kvalitu a bezpečnosť. Oceňujem vašu odbornosť a čestnosť, ktoré sú pre klientov veľmi dôležité."
JL-INSTAL s.r.o.Voda Plyn Kúrenie,JL-INSTALVODA,http://www.jl-instal.sk/,+421 917 633 744,Senec,Vodoinštalatér,"Firma JL-INSTAL sa špecializuje na komplexné služby v oblasti plynoinštalácií, vodoinštalatérskych a kúrenárskych prác. S viac ako 12-ročnou praxou zabezpečuje profesionálne a kvalitné vykonanie všetkých inštalatérskych úloh, od najjednoduchších po najzložitejšie. Zákazníkom poskytujú čestnú a otvorenú komunikáciu, pričom garantujú 100% odvedenie práce.","Dobrý deň. Páči sa mi, že v JL-INSTALVODA sa venujete efektívnemu riešeniu problémov v oblasti vykurovania a inštalácie vodovodných a plynových rozvodov. Je zrejmé, že kladiete dôraz na spokojnosť zákazníkov a kvalitu poskytovaných služieb."
GAZ-TERM | Daniel Palko,GAZ-TERM,http://www.gaz-term.sk/,+421 907 159 269,Považská Bystrica,Obchod s potrebami pre inštalatérov,"Spoločnosť GAZ-TERM, so sídlom v Považskej Bystrici, je renomovaným poskytovateľom riešení v oblasti vodoinštalácií, vykurovania a plynoinštalácií od roku 1992. S širokým portfóliom produktov, vrátane kotlov na rôzne palivá, tepelného čerpadla a sanita, sa zameriava na kvalitu a ekologické riešenia pre domácnosti a firmy. GAZ-TERM je najväčším predajcom tepelnej a solárnej techniky v regióne, pričom kladie dôraz na profesionálne služby a súvisiace produkty pre svojich zákazníkov. 

Spoločnosť sa môže pochváliť skúsenosťami v oblasti inštalácií a servisu vykurovacích a vodoinštalačných systémov, pričom ponúka aj široký sortiment montážneho a inštalačného materiálu. GAZ-TERM je známy pre svoj prístup k zákazníkom, kde sa usiluje o plnenie ich individuálnych potrieb a požiadaviek, čo vytvára dlhodobé vzťahy s partnermi a zákazníkmi.","Dobrý deň. Páči sa mi, že v GAZ-TERM sa venujete ponuke širokého spektra produktov a služieb pre vodu, plyn a kúrenie, čím zabezpečujete komfort a spokojnosť svojich zákazníkov."
PRIPOJKY.info | Projekty voda - kanalizácia - plyn - elektrika - elektroinštalácie,PRIPOJKY,https://pripojky.info/,+421 915 768 953,"Opatovce, Žitavany",Projektantské služby,"Firma PRIPOJKY sa špecializuje na komplexné služby v oblasti inžinierskych sietí, pričom poskytuje projektovú dokumentáciu a realizáciu prípojok plynu, vody a kanalizácie na kľúč. S dôrazom na kvalitu a profesionalitu sa firma zameriava na individuálne požiadavky klientov, pričom zabezpečuje aj komunikáciu s úradmi a vybavenie potrebných povolení. Ročne realizuje množstvo projektov v rôznych regiónoch Slovenskej republiky, s osobitným dôrazom na spokojnosť zákazníkov a dodržiavanie dohodnutých termínov.","Dobrý deň. Páči sa mi, že v PRIPOJKY sa venujete komplexnej realizácii inžinierskych sietí, čo je veľmi dôležité pre bezproblémové pripojenie domácností a iných objektov."
"Kúrenie, voda, plyn-Pavol Jakubec","Kúrenie, voda, plyn-Pavol Jakubec",,+421 905 839 211,Turzovka,Kúrenárske práce,,
ABSOL s.r.o.,ABSOL,http://www.absol.sk/,+421 918 583 574,Pezinok,Obchod,"Spoločnosť ABSOL s.r.o. pôsobí na slovenskom trhu už 21 rokov a špecializuje sa na obchodnú, dodávateľskú a montážnu činnosť v oblasti nadštandardného technického vybavenia stavieb. Ponúkajú kvalitné služby v oblasti inštalácie vody, plynu a kúrenia, ako aj realizácie stavebných projektov od A po Z.","Dobrý deň. Páči sa mi, že v ABSOL sa venujete modernizácii a výstavbe, pričom sa sústredíte na nadštandardné technické vybavenie stavieb, čo je v súčasnosti veľmi dôležité pre zvyšovanie komfortu a funkčnosti bývania."
Montinštala,Montinštala,http://www.montinstala.sk/,+421 903 235 563,Lužianky,Vodoinštalatér,"Firma Montinštala, rodinná spoločnosť s dvadsaťročnou tradíciou, sa špecializuje na komplexné služby v oblasti montáže a údržby systémov vody, plynu a kúrenia. Ich odbornosť a skúsenosti sú zárukou spoľahlivej starostlivosti o teplý a komfortný domov, pričom sa zaoberajú aj čistením vykurovacích sústav a zdravotechnikou.","Dobrý deň. Páči sa mi, že v Montinštala sa venujete komplexným službám v oblasti vody, plynu a kúrenia, a že sa zameriavate na kvalitné čistenie vykurovacích systémov. Vaša odbornosť a dlhoročná prax sú určite zárukou spokojnosti klientov."
Revízie plynových zariadení - RTHOMOLA,Revízie plynových zariadení,https://www.rthomola.sk/,+421 903 606 010,Nitra,Služba inštalácie plynu,"Firma RTHOMOLA sa špecializuje na revízie a odborné zapojenie plynových zariadení, pričom na trhu pôsobí už viac ako 34 rokov. Montáže a revízie plynových zariadení sú vykonávané s dôrazom na bezpečnosť a kvalitu, čím sa zabezpečuje bezproblémová prevádzka pre domácnosti, firmy a obce. Pravidelná revízia plynových zariadení môže predchádzať nebezpečným situáciám a zvyšovať úspory nákladov na prevádzku.","Dobrý deň. Páči sa mi, že v Revízie plynových zariadení sa venujete zabezpečeniu bezpečnosti a účinnosti plynových zariadení. Vaša dlhoročná odborná činnosť a spokojnosť zákazníkov sú skutočne pôsobivé."
"Plynomont, S.r.o.",Plynomont,https://www.novezamky.sk/plynomont-s-r-o/os-1748,+421 35/642 42 24,Nové Zámky,,"Plynomont, s.r.o. je spoločnosť sídliaca v Nových Zámkoch, ktorá sa špecializuje na inštaláciu a rozvod plynu. V poskytovaných službách sa zameriava nielen na priemyselnú výrobu a zákazkovú výrobu, ale aj na ubytovacie a stravovacie služby, čím pokrýva široké spektrum potrieb svojich zákazníkov.","Dobrý deň. Páči sa mi, že v Plynomont sa venujete kvalitnej inštalácii a rozvodu plynu, čím prispievate k bezpečnosti a komfortu vo využívaní plynových zariadení vo vašej oblasti."
V-K-Plyn,V-K-Plyn,https://v-k-plyn.sk/,+421 904 137 502,,Kúrenárske práce,"Firma V-K-Plyn sa špecializuje na inštalatérske a kúrenárske služby s viac ako 25-ročnou praxou na trhu. Poskytujú komplexné riešenia pre vodoinštaláciu, kanalizáciu, plynové kotly a tepelné čerpadlá, pričom ich odborný prístup zaručuje vysokú kvalitu a spokojnosť zákazníkov.","Dobrý deň. Páči sa mi, že vo V-K-Plyn sa venujete širokej škále inštalatérskych a kúrenárskych služieb, čo jasne ukazuje vašu odbornú prax a orientáciu na kvalitu práce."
Nyári Ján,NYÁRI,http://www.nyari.sk/,+421 905 666 551,Dubník,Vodoinštalatér,"Webová stránka NYÁRI poskytuje cenné informácie o rôznych témach, od podnikania v akciových spoločnostiach po tipy na bytové dekorácie a organizačné rady na zefektívnenie domácich prác. Zameriava sa na praktické rady a triky, ktoré môžu čitatelia použiť v každodennom živote, a to všetko z pohodlia ich domovov. Okrem toho sa stránka neustále aktualizuje, aby ponúkala aktuálne trendy a užitočné informácie v rôznych oblastiach.","Dobrý deň. Páči sa mi, že v NYÁRI sa venujete zdieľaniu praktických a užitočných informácií, ktoré sa týkajú širokej škály tém, ako sú bytové dekorácie a podnikanie, čím pomáhate čitateľom zlepšovať ich každodenný život."
Gasrev s.r.o.,Gasrev,https://gasrev.sk/,+421 915 300 345,Košice,Plynoinštalatér,"Firma Gasrev sa špecializuje na revíziu plynových zariadení a zabezpečuje pravidelnú kontrolu plynových spotrebičov v domácnostiach a podnikoch. S profesionálnym a odborným prístupom garantuje bezpečnosť a bezporuchovú prevádzku plynových zariadení, čo je zásadné pre ochranu zdravia a života. V rámci svojich služieb vykonáva kontrolu tesnosti, tlakové skúšky a ďalšie dôležité merania, pričom používa moderné prístroje na zabezpečenie kvalitnej a presnej práce. Ich tím odborníkov je pripravený poskytnúť komplexné služby, zamerané na prevenciu potenciálnych rizík spojených s plynovými zariadeniami.","Dobrý deň. Páči sa mi, že v Gasrev sa venujete nielen revíziám plynových zariadení, ale aj prevencii rizík, ktoré z nich vyplývajú. Je zrejmé, že si veľmi zakladáte na bezpečnosti a spokojnosti vašich klientov, čo je v dnešnej dobe veľmi dôležité."
Revízny technik - východ,Revízny technik,https://www.reviznytechnik-vychod.sk/,+421 919 141 487,,Služba inštalácie plynu,"Revízny technik Východ sa špecializuje na revízie plynových a tlakových zariadení, pričom pôsobí v východnej časti Slovenska. S bohatými skúsenosťami a certifikáciou ponúka rýchle a profesionálne služby pre domácnosti, firmy a správcov bytových domov. V oblasti správy plynových kotlov a rozvodov zaručuje dodržiavanie predpisov, flexibilnosť a férové ceny bez skrytých poplatkov.","Dobrý deň. Páči sa mi, že v Revízny technik sa venujete zabezpečeniu pravidelných a výstupných revízií plynových a tlakových zariadení, čím prispievate k bezpečnosti a spokojnosti vašich klientov."
REVÍZIE PLYNU a plynových zariadení,REVÍZIE PLYNU a plynových zariadení,,+421 940 225 747,Žilina,Plynoinštalatér,,
Revízie a servis s.r.o.,Revízie a servis,http://www.revizieaservis.sk/,+421 908 711 850,"Veča, Šaľa",Kúrenárske práce,"Revízie a servis s.r.o. je odbornou firmou zameranou na prevádzku a údržbu vyhradených technických zariadení plynových a tlakových. Naša činnosť zahŕňa odborné prehliadky a skúšky, ako aj pravidelnú kontrolu vykurovacích systémov, čo je nevyhnutné pre zabezpečenie ich bezpečnej a efektívnej prevádzky. V rámci našich služieb poskytujeme aj montáž, servis a opravu plynových kotlov rôznych renomovaných značiek. Naša odborná prax a zameranie zabezpečujú vysokú kvalitu služby a spokojnosť klientov.","Dobrý deň. Páči sa mi, že v Revízie a servis sa venujete komplexnému servisu plynových a tlakových zariadení, čo je v súčasnosti veľmi dôležité pre udržanie bezpečnosti a efektívnosti vykurovacích systémov."
Voda - plyn - kúrenie,Voda,https://vizgazfutes.ewk.hu/,+421 908 642 753,Komárno,Mechanik,"Firma Voda sa špecializuje na komplexné služby v oblasti vodoinštalácie a kúrenia, čím pokrýva široké spektrum potrieb zákazníkov. Od opráv a výmeny sanitárnych zariadení, cez údržbu plynových spotrebičov, až po modernizáciu vykurovacích systémov, poskytujú profesionálne a zabezpečené riešenia v rámci mnohých regiónov. ","Dobrý deň. Páči sa mi, že vo Voda sa venujete širokému spektru služieb v oblasti vodoinštalácie a plynového vykurovania, čo je v súčasnej dobe veľmi dôležité pre zabezpečenie komfortu domácnosti."
Revízie Bratislava,Revízie Bratislava,http://www.revizieba.sk/,+421 910 681 668,Petržalka,Elektrikár,"Revízie Bratislava je renomovaná spoločnosť, ktorá sa špecializuje na poskytovanie kvalitných revíznych služieb v oblasti elektroinštalácií, zabezpečovacích systémov a plynových zariadení. S 15-ročnými skúsenosťami a vysokou profesionalitou, spoločnosť garantuje rýchle a efektívne vykonanie revíznych služieb, pričom sa zameriava na zabezpečenie bezpečnosti a spokojnosti svojich klientov. Revízia elektrických zariadení je nevyhnutnou súčasťou udržania bezpečnosti nehnuteľností a prevádzkarní, a spoločnosť Revízie Bratislava poskytuje službu vypracovania revíznych správ do 24 hodín.","Dobrý deň. Páči sa mi, že v Revízie Bratislava sa venujete poskytovaniu komplexných revíznych služieb a zabezpečujete bezpečnosť elektroinštalácií a iných zariadení pre Vašich klientov. Rád by som sa dozvedel viac o možnosti spolupráce a Vašich prístupoch k poskytovaniu týchto služieb."
Molnár - revízia plynu,Molnár,,+421 918 749 210,,Služba inštalácie plynu,,
Vzduchotechnika-shop.sk,Vzduchotechnika-shop,https://vzduchotechnika-shop.sk/,+421 949 762 827,Mužla,Elektronické obchodovanie,"Vzduchotechnika-shop sa zameriava na široký sortiment ventilátorov a vzduchotechnických komponentov, pričom ponúka produkty pre rôzne aplikácie, od domácností po priemyselné využitie. V ponuke nájdete ventilátory do kúpeľne, priemyselné ventilátory, potrubia a príslušenstvo, čím zabezpečujú komplexné riešenia pre efektívnu ventiláciu a komfort v prostredí.","Dobrý deň. Páči sa mi, že vo Vzduchotechnika-shop sa venujete poskytovaniu kvalitných produktov pre ventilačné systémy a ponúkate široký výber ventilátorov, ktorý oslovuje rôzne potreby zákazníkov."
AMEXX s.r.o.,AMEXX,https://amexx.sk/,+421 948 912 150,Mužla,Elektronické obchodovanie,"Firma AMEXX sa špecializuje na poskytovanie kvalitných produktov v oblasti vzduchotechniky a systémov ventilácie. S rozsiahlym portfóliom, ktoré zahŕňa ventilátory do kúpeľne, rekuperačné jednotky a spiro potrubie, je AMEXX ideálnym partnerom pre každého, kto hľadá efektívne riešenia pre zlepšenie kvality vzduchu. Naša ponuka je navrhnutá tak, aby vyhovovala rôznym potrebám a požiadavkám zákazníkov, pričom kladieme dôraz na inovatívne technológie a výnimočnú kvalitu produktov.","Dobrý deň. Páči sa mi, že v AMEXX sa venujete inovatívnym riešeniam v oblasti vzduchotechniky a váš široký výber produktov, od ventilátorov po rekuperačné jednotky, vyniká na trhu. Vážim si vašu orientáciu na kvalitu a spokojnosť zákazníkov."
IDEÁL Klíma,IDEÁL,,+421 911 218 996,Mužla,,,
Coldex - Klimatizačná Technika,Coldex,,+421 903 226 337,Štúrovo,Dodávateľ klimatizácií,,
Lokálna rekuperácia Blauberg,Lokálna rekuperácia Blauberg,https://vzduchotechnika-shop.sk/rekuperatory-rekuperacia/rekuperatory-do-jednej-miestnosti,+421 904 040 498,Mužla,Dodávateľ vzduchotechniky,"Lokálna rekuperácia Blauberg sa špecializuje na inovatívne systémy rekuperácie tepla, ktoré zabezpečujú efektívnu výmenu vzduchu a znižujú energetické náklady. Ich produktové portfólio zahŕňa široké spektrum zariadení pre rôzne aplikácie, a to vrátane ventilátorov, potrubí a príslušenstva, ktoré sú navrhnuté s dôrazom na kvalitu a efektívnosť. V súčasnosti je dôležité minimalizovať energetickú náročnosť budov a zabezpečiť príjemné a zdravé prostredie pre obyvateľov. 
Rekuperačné systémy od Blauberg sa zameriavajú na optimálny prietok vzduchu a vytvárajú hygienicky čistý priestor. Vďaka moderným technológiam a kvalite materiálov sú schopné poskytovať dlhodobé riešenia pre udržateľné vykurovanie a vetranie, čím prispievajú k ekologickému životnému štýlu a šetreniu životného prostredia.","Dobrý deň. Páči sa mi, že v Lokálna rekuperácia Blauberg sa venujete inovatívnym a efektívnym riešeniam pre rekuperáciu tepla a vzduchotechniku. Váš prístup k znižovaniu energetických nákladov a zabezpečeniu kvalitného vnútorného prostredia je obdivuhodný."
"ELEKTRO KLIMA NZ, s.r.o.",ELEKTRO,http://www.elektroklimanz.sk/,+421 35/642 10 86,"Dolná kapsa, Nové Zámky",Dodávateľ klimatizačných systémov,"Spoločnosť ELEKTRO KLIMA NZ sa špecializuje na poskytovanie komplexných riešení v oblasti klimatizácie a vzduchotechniky. Ponúka široký sortiment produktov, vrátane klimatizačných jednotiek od renomovaných značiek, tepelných čerpadiel a vzduchotechnických systémov, pričom zabezpečuje profesionálnu inštaláciu a servis. Firma tiež poskytuje dlhoročnú záruku na svoje produkty a odborné poradenstvo, čím sa postara o spokojnosť svojich klientov.","Dobrý deň. Páči sa mi, že v ELEKTRO KLIMA NZ sa venujete profesionálnemu prístupu k inštalácii a údržbe klimatizácií, čo svedčí o Vašej odbornosti a dôraze na kvalitu služieb."
Rekuperácia,Rekuperácia,https://a-rekuperacia.sk/obchodne-podmienky.html,+421 948 912 150,Mužla,,no content,
VZDUCHOTECHNIKA KLIMAC s.r.o.,VZDUCHOTECHNIKA KLIMAC,http://www.klimac.sk/,+421 903 437 170,Bratislava,Dodávateľ klimatizácií,"VZDUCHOTECHNIKA KLIMAC je odborníkom v oblasti vzduchotechniky a klimatizácie so 30-ročnou históriou. Spoločnosť sa zameriava na poskytovanie jedinečných riešení pre domácnosti, podnikanie a priemysel s dôrazom na kvalitu a efektivitu. Ich portfólio zahŕňa klimatizačné zariadenia, tepelné čerpadlá a systémy rekuperácie vzduchu, pričom sú výhradným distribútorom značky Daikin na Slovensku.","Dobrý deň. Páči sa mi, že vo VZDUCHOTECHNIKA KLIMAC sa venujete poskytovaniu komplexných a individuálnych riešení pre vzduchotechniku a klimatizáciu, čím prispievate k zvyšovaniu komfortu a kvality životného prostredia pre vašich klientov."
