title,company_name_reworked,website,phone,city,category,abstract,ai_first_sentence
DaVerStav s.r.o.,DaVerStav,https://zateplovaniedomov.eu/,+421 918 540 350,Michalovce,Dodávateľ,"DaVerStav je renomovaná stavebná firma, ktorá sa špecializuje na zateplovanie domov a komplexné stavebné práce. S viac ako desaťročnou praxou v odbore ponúkame široké spektrum služieb, od tepelnej izolácie fasád po rekonstrukcie interiérov a exteriérov. Našou prioritou je maximálna spokojnosť klientov, ktorú dosahujeme individuálnym prístupom a profesionálnou kvalitou našich realizácií.
Naša ponuka zahrňuje zateplenie, výstavbu rodinných domov, úpravy interiérov, fasádne práce, vizualizácie, ako aj poskytovanie energetických certifikátov. S dôrazom na kvalitu a efektívnosť sa snažíme minimalizovať náklady na energie našich klientov a zlepšiť ich komfort bývania. Vytvárame komplexné riešenia, ktoré sú prispôsobené potrebám každého zákazníka a dodržiavame dohodnuté cenové podmienky.","Dobrý deň. Páči sa mi, že v DaVerStav sa venujete kvalite a profesionalite pri zateplovaní a realizáciách stavebných projektov. Vaša snaha o individuálny prístup a maximálnu spokojnosť klientov je v dnešnej dobe veľmi cenná."
Zateplovanie-Fasady-Stavby,Zateplovanie-Fasady-Stavby,,+421 951 287 133,Dechtice,Stavebná firma,,
ŠADA - špecialisti na strechy a fasády,ŠADA,http://www.sada.sk/,+421 905 825 315,Poprad-Priemyselný obvod - západ,Stavebné služby,"Firma ŠADA sa špecializuje na komplexné riešenia pre stavby a obnovu budov, so zameraním na strechy, fasády a zateplenie. S viac ako 30 rokmi skúseností a viac ako 200 dokončenými projektmi ponúkame hlbokú odbornú znalosť a zručnosti, ktoré zaisťujú kvalitné a trvácne výsledky pre našich klientov. S vlastným vozovým parkom a tímom odborníkov zabezpečujeme bezproblémovú realizáciu všetkých projektov, pričom sa sústredíme na detail a precíznosť vo všetkých aspektoch stavebných prác.","Dobrý deň. Páči sa mi, že v ŠADA sa venujete poskytovaniu komplexných riešení pre stavebné projekty a rekonštrukcie s dôrazom na kvalitu a spokojnosť zákazníkov."
Maximus company s. r. o. - Stavby a rekonštrukcie na kľúč,Maximus company,https://maximuscompany.sk/,+421 949 771 397,Nové Zámky,Stavebné služby,"Maximus company s.r.o. sa špecializuje na poskytovanie širokého spektra stavebných a rekonštrukčných prác. Naším cieľom je zabezpečiť kvalitu, spoľahlivosť a pohodlie pre našich zákazníkov počas celého procesu realizácie projektu. S množstvom úspešne dokončených rekonštrukcií a bohatými skúsenosťami na trhu ponúkame komplexné riešenia, ktoré zohľadňujú technické aspekty aj efektívnu komunikáciu s klientmi.","Dobrý deň. Páči sa mi, že v Maximus company sa venujete poskytovaniu komfortných stavebných služieb, čo nepochybne prispieva k lepším skúsenostiam zákazníkov."
Rekunst,Rekunst,http://www.rekunst.sk/,+421 905 609 311,"Pavlov Dvor, Hurbanovo",Stavebná firma,"Firma ReKunst, ktorá sa etablovala od roku 1992, sa špecializuje na výrobu a dodávku ozdobných fasádnych profilov najvyššej kvality. S cieľom transformovať budovy na elegantné a pôsobivé diela ponúkajú širokú paletu produktov, ktoré umožňujú zákazníkom prispôsobiť si vzhľad svojich nehnuteľností podľa vlastných predstáv.
ReKunst sa môže pochváliť dlhoročnými skúsenosťami a odbornosťou v oblasti stavebníctva. S tímom profesionálov dokáže riešiť aj náročné projekty, pričom garantuje kvalitné služby a vysokú spokojnosť zákazníkov. Jej produkty sú nielen estetické, ale aj praktické, pričom sa dajú ľahko montovať a odolávajú poveternostným vplyvom.","Dobrý deň. Páči sa mi, že v Rekunst sa venujete výrobe ozdobných fasádnych profilov, ktoré dokážu premeniť aj obyčajné budovy na výnimočné diela. Vaša široká ponuka a zameranie na kvalitu my prichádzajú veľmi imponujúce."
Zatepľovanie Košice-Esostav,Zatepľovanie Košice-Esostav,http://eso-stav.sk/,+421 944 111 630,Košice,Stavebná firma,"Zatepľovanie Košice-Esostav sa špecializuje na komplexné stavebné služby, vrátane zatepľovania, rekonštrukcií a výstavby základov. Firma s dlhoročnými skúsenosťami garantuje kvalitné a spoľahlivé riešenia, ktoré sú prispôsobené individuálnym potrebám zákazníkov. V Košickom kraji sa zameriava na zníženie tepelných strát a zvýšenie komfortu bývania pomocou kvalitných materiálov a presného prevedenia. ","Dobrý deň. Páči sa mi, že v Zatepľovanie Košice-Esostav sa venujete kvalitnému zatepľovaniu rodinných domov a rekonštrukciám, čím prispievate k zvyšovaniu pohodlia a energetickej efektivity v domácnostiach."
"STAV - ZAT, s.r.o. - Stavby a zateplenie",STAV,http://www.stavzat.sk/,+421 903 718 939,Bratislava,Stavebná firma,"STAV-ZAT s.r.o. je renomovaná spoločnosť so zameraním na výstavbu a zateplenie domov, ktorá pôsobí na trhu od roku 1989. S viac ako 34-ročnými skúsenosťami v odbore poskytuje široké spektrum služieb vrátane realizácie stavby na kľúč, profesionálneho zateplenia fasád a komplexných rekonštrukcií domov. Spoločnosť sa pýši kvalitou svojich služieb a dlhodobou spoluprácou s overenými dodávateľmi kvalitných stavebných materiálov.
STAV-ZAT kladie dôraz na detaily a profesionálny prístup, čo dokazuje množstvo zrealizovaných projektov a spokojných klientov. Ich portfólio obsahuje rôzne typy stavieb, od rodinných domov po obytné budovy, pričom každá realizácia odpovedá najvyšším štandardom kvality. Spoločnosť je pripravená splniť sny zákazníkov o vlastnom bývaní s dôrazom na osobný prístup a profesionálnu pomoc pri plánovaní a realizácii projektov.","Dobrý deň. Páči sa mi, že v STAV sa venujete kvalitnej a profesionálnej výstavbe domov a zatepleniu, čo je v dnešnej dobe veľmi dôležité pre energetickú efektívnosť a komfort bývania."
IZOMER s.r.o.,IZOMER,http://www.izomer.sk/,+421 903 727 829,Levice,Stavebná firma,"Firma IZOMER, s.r.o. sa špecializuje na hydroizolácie, pokrývačské a tesárske práce s viac ako 23-ročnou skúsenosťou na trhu. Ich zameranie na kvalitu, komplexnosť služieb a certifikácie zaručujú spokojnosť klientov a odborný prístup ku všetkým projektom.","Dobrý deň. Páči sa mi, že v IZOMER sa venujete hydroizoláciám a pokrývačským prácam s dôrazom na kvalitu a technologické predpisy."
Fasádne a zatepľovacie práce,Fasádne a zatepľovacie práce,https://fasadneprace.sk/,+421 910 963 592,Krasňany,Stavebná firma,"Firma Fasádne a zatepľovacie práce sa špecializuje na odborné zatepľovacie a fasádne riešenia, pričom kladie dôraz na kvalitu a profesionalitu svojich služieb. S dlhoročnými skúsenosťami a certifikovanými materiálmi zabezpečuje úspešné realizácie projektov, ktoré sú pripravené na aktuálne požiadavky stavebného trhu. ","Dobrý deň. Páči sa mi, že vo Fasádne a zatepľovacie práce sa venujete vysokokvalitným fasádnym a zatepľovacím službám, pričom dbáte na dôslednú prípravu a plánovanie, čo je v tejto oblasti kľúčové."
Deseka spol. s r.o.,Deseka,http://www.deseka.sk/,+421 944 120 440,Nová Dubnica,Stavebná firma,"Deseka s.r.o. je rodinná stavebná firma, ktorá pôsobí na slovenskom trhu od roku 1993. S bohatými skúsenosťami v oblasti výstavby domov, zateplenia a rekonštrukčných prác, spoločnosť sa špecializuje na realizáciu domov na kľúč, zateplenie fasád a strešných konštrukcií s využitím ekologických a moderných materiálov. Okrem toho ponúkajú aj komplexné interiérové práce, ktoré zabezpečujú kvalitné a funkčné bývanie pre svojich klientov.
Deseka sa v súčasnosti zameriava na znižovanie energetických nárokov na bývanie, pričom ponúkajú služby v oblasti obnovy starších domov a výstavby nových rodinných domov na kľúč. Spolupracujú so skúsenými projektantmi a dodávateľmi, čo zabezpečuje komplexnosť a kvalitu poskytovaných služieb, a to nielen v Trenčianskom kraji, ale aj mimo neho.","Dobrý deň. Páči sa mi, že v Deseka sa venujete znižovaniu energetických nárokov na bývanie a využívate moderné a ekologické materiály vo vašich projektoch."
fasadytiptop s.r.o,fasadytiptop,https://fasadytiptop.sk/,+421 903 733 139,Plevník - Drienové,Dodávateľ stavebných materiálov,"Fasády TipTop je stavebná spoločnosť, ktorá sa špecializuje na zatepľovanie rodinných a bytových domov, ako aj polyfunkčných objektov. Okrem toho zabezpečuje kompletné rekonštrukcie a realizuje dekoračné interiérové a exteriérové omietky, vonkajšie žalúzie a rolety.","Dobrý deň. Páči sa mi, že vo fasadytiptop sa venujete zatepľovaniu a rekonštrukciám objektov na profesionálnej úrovni, pričom kladiete dôraz na kvalitu detailov a dlhodobú životnosť systémov."
THORSTAV s.r.o.,THORSTAV,https://www.thorstav.sk/,+421 905 377 234,Zvolen,Dodávateľ stavebných materiálov,"Firma THORSTAV s.r.o., založená v apríli 2015, sa špecializuje na komplexnú obnovu a výstavbu rodinných a bytových domov. S viac ako dvadsaťročnými skúsenosťami našich pracovníkov a licenciou na zhotovenie vonkajších tepelnoizolačných kontaktných systémov sme pripravení zabezpečiť vysokokvalitné stavebné služby pre našich zákazníkov.","Dobrý deň. Páči sa mi, že v THORSTAV sa venujete komplexnej obnove a výstavbe budov, čo svedčí o vašich odborných znalostiach a záväzku k maximálnej spokojnosti zákazníka."
Fasádne centrum-Profinex,Fasádne centrum-Profinex,http://www.fasadne-centrum.sk/,+421 31/551 79 51,Dunajská Streda,Stavebniny,"Fasádne centrum-Profinex je renomovaná firma so skúsenosťami od roku 2002, ktorá sa špecializuje na predaj certifikovaných tepelných a zvukových izolácií. Ponúka široký sortiment produktov, vrátane polystyrénu EPS a minerálnej vlny, stavebných lepidiel, fasádnych omietok a ďalších potrebných komponentov pre zateplenie budov. Zákazníkom zabezpečuje komplexné služby vrátane realizácie zateplenia a prenájmu lešenia, čím garantuje výhodné ceny a kvalitu prác.","Dobrý deň. Páči sa mi, že vo Fasádne centrum-Profinex sa venujete poskytovaniu kvalitných tepelných izolácií a komplexným službám v oblasti zateplenia. Vaša dlhoročná prax na trhu a ponuka certifikovaných produktov svedčí o profesionalite a zameraní na spokojnosť zákazníkov."
FASÁDIČKA s.r.o.,FASÁDIČKA,https://www.fasadicka.sk/,+421 917 455 121,Malacky,Stavebniny,"FASÁDIČKA je renomovaná spoločnosť so sídlom v Malackách, ktorá sa zaoberá predajom kvalitného stavebného materiálu a je certifikovaným výrobcom väzníkových krovov. V ponuke má široký sortiment produktov a služieb, ktoré pokrývajú všetky aspekty stavebného proces a zabezpečujú komplexný servis pre zákazníkov. Tím odborníkov je pripravený poskytnúť poradenstvo a individuálny prístup pri realizácii projektov, čo prispieva k vysokému počtu spokojných zákazníkov.","Dobrý deň. Páči sa mi, že vo FASÁDIČKA sa venujete komplexnému predaju stavebného materiálu a zameriavate sa aj na výrobu a montáž väzníkových krovov, čo svedčí o vašej odbornej zdatnosti a dlhoročnej praxi v oblasti stavebníctva."
"Media Construction,s.r.o Trstice 477",MEDIA,http://kamennepodlahy.sk/,+421 949 465 993,Trstice,Stavebná firma,"Firma MEDIA sa špecializuje na inovatívne riešenia v oblasti marketingu a komunikácie, pričom kladie dôraz na tematické obsahy adaptované podľa potrieb klientov. S dôrazom na kvalitu a profesionálny prístup zabezpečuje komplexné služby, ktoré posilňujú firemnú identitu a rozširujú dosah na cieľovú skupinu. V rámci svojich aktivít MEDIA ponúka poradenstvo a realizáciu kampaní s použitím moderných nástrojov a technológii, čím podporuje rast a konkurenčnú výhodu svojich klientov.","Dobrý deň. Páči sa mi, že v MEDIA sa venujete inovatívnym marketingovým stratégiám, ktoré sú prispôsobené potrebám vašich klientov."
FASÁDNE ŠTÚDIO,FASÁDNE ŠTÚDIO,http://www.fasadanadom.sk/kontakt.html,+421 905 483 900,Leopoldov,,"FASÁDNE ŠTÚDIO, spoločnosť REAL FLOOR s.r.o., ponúka široké spektrum služieb v oblasti fasád a interiérov. S dôrazom na kvalitné zatepľovacie systémy, dekoratívne omietky a priemyselné podlahy zabezpečuje komplexné riešenia pre oživenie a ochranu nehnuteľností. Ich profesionálny prístup a široká škála produktov oslovujú zákazníkov, ktorí hľadajú estetické a funkčné zlepšenia svojich priestorov.","Dobrý deň. Páči sa mi, že vo FASÁDNE ŠTÚDIO sa venujete inovatívnym riešeniam v oblasti fasád a interiérov. Vaša ponuka dekoratívnych omietok a zatepľovacích systémov zaručuje kvalitný vizuálny aj technologický štandard, ktorý je v dnešnej dobe veľmi žiadaný."
"STAVOMAT, s.r.o., Košice","STAVOMAT, Košice",http://www.stavomat.com/,+421 55/729 96 74,Juh,Obchod s farbami,"Spoločnosť STAVOMAT, s.r.o. je odborníkom na poskytovanie komplexných riešení v oblasti zateplenia a fasádnych systémov v regióne Košice. S dôrazom na kvalitu a funkčnosť ponúkajú široké spektrum produktov, ako sú stavebná chémia, dekoratívne omietky a terasy Twinson, ktoré zabezpečujú estetický vzhľad a energetickú efektívnosť budov. Spojením moderných technológií a odborných znalostí poskytujú služby od návrhu po realizáciu, pričom sa zameriavajú na individuálne potreby zákazníkov a garantujú vysokú kvalitu realizácií.","Dobrý deň. Páči sa mi, že v STAVOMAT, Košice sa venujete inovatívnym riešeniam pre zateplenie budov, čo je mimoriadne dôležité v súčasnej dobe z hľadiska energetickej efektívnosti a ochrany životného prostredia. Rád by som sa s Vami podelil o niekoľko myšlienok, ktoré by mohli byť prospešné pre Vašu spoločnosť."
Wall Systems s.r.o.,WALL,http://www.wallsystems.sk/,+421 907 396 982,"Tatranská Kotlina, Vysoké Tatry",Stavebná firma,"Spoločnosť WALL Systems sa špecializuje na zatepľovanie a renováciu fasád, pričom disponuje viac ako desaťročnými skúsenosťami v obore. Naším cieľom je poskytovať kvalitné a esteticky príťažlivé riešenia pre bytové a administratívne budovy, pričom využívame moderné technológie a materiály, ktoré zabezpečujú dlhodobú funkčnosť a atraktivitu fasád. Zameriavame sa aj na komplexnú renováciu interiérov s dôrazom na detaily a kvalitu vykonanej práce.","Dobrý deň. Páči sa mi, že v WALL sa venujete zatepleniu a revitalizácii fasád s maximálnou precíznosťou a s dôrazom na moderné materiály a technológie."
"FABRICK SK, s.r.o.",FABRICK SK,http://www.fabrick.sk/,+421 905 443 040,Veľký Meder,Dodávateľ stavebných materiálov,"FABRICK SK je rodinná firma so žilou tradičného zamerania na výrobu a dodávku tehlových fasád a obkladov na Slovensku. S takmer 30-ročnou praxou na trhu ponúkajú kvalitné a esteticky vynikajúce produkty, ktoré sú výsledkom technologickej inovácie a remeselnej zručnosti. Ich portfólio zahŕňa široký výber lícových tehál, tehlových obkladov a fasádnych systémov, čo prispieva k rozmanitosti architektonických projektov.","Dobrý deň. Páči sa mi, že vo FABRICK SK sa venujete špičkovým technológiam v oblasti tehlových obkladov a fasád, pričom sa zameriavate na kvalitné slovenské výrobky. Rád by som sa dozvedel viac o vašich inováciách a prístupe k projektom."
COBRA strešné a fasádne systémy,COBRA,http://www.cobra-strechy.sk/,+421 37/651 76 53,"Mlynárce, Nitra",Stavebniny,"Firma COBRA ponúka odborné a bezpečné postupy pri likvidácii azbestu, pričom disponuje licenciou na odstraňovanie tohto nebezpečného materiálu. S viac než 30-ročnou praxou v odvetví je COBRA zárukou kvality a efektivity pri zabezpečovaní komplexných riešení, od diagnostiky až po odbornú likvidáciu odpadu azbestu.
Medzi hlavné služby patrí predaj kvalitných vláknocementových dosiek a strešných systémov, ktoré spĺňajú vysoké štandardy. Naša firma sa snaží poskytovať inovatívne a účinné riešenia, ktoré vyhovujú rôznym stavebným a priemyselným potrebám klientov.","Dobrý deň. Páči sa mi, že v COBRA sa venujete odbornému a bezpečnému odstráneniu azbestu, čo je v súčasnosti veľmi dôležité pre ochranu zdravia a životného prostredia. Vážim si vašu angažovanosť v oblasti dodržiavania najprísnejších štandardov kvality a bezpečnosti vo všetkých vašich projektoch."
"Cirfus Juraj, Ing. arch. - Ateliér Juraj Cirfus","Cirfus Juraj, Ing. arch.",,+421 32/743 56 17,Hurbanovo,Architekt,,
Hx2 ateliér,HX2,,+421 944 943 075,Štúrovo,Architektonický dizajnér,,
Architektonický ateliér IMA,Architektonický ateliér IMA,http://www.atelierima.sk/,+421 908 468 295,Nové Zámky,Architektonická kancelária,"Architektonický ateliér IMA sa zameriava na návrh moderných a funkčných stavebných objektov, pričom kladie dôraz na inovatívne prístupy a minimalizmus. Ateliér sa prezentuje širokým portfóliom projektov, od obytných budov po občianske a výrobné stavby, čím reflektuje aktuálne trendy v architektúre a potreby klientov.","Dobrý deň. Páči sa mi, že v Architektonickom ateliéri IMA sa venujete inovatívnym a moderným riešeniam v oblasti architektúry, čo je evidentné z vašich zaujímavých projektov ako Dom seniorov v Palárikove a bytový dom Grand Koliba. Vaša pozornosť na detaily a funkčnosť designu je skutočne obdivuhodná."
ARCHITEKTONICKY ATELIER PODOBA,ARCHITEKTONICKY ATELIER PODOBA,https://www.instagram.com/atelierpodoba/,+421 918 517 093,Sklené Teplice,Architektonická kancelária,"Architektonický ateliér PODOBA sa špecializuje na tvorbu inovatívnych a funkčných architektonických riešení, ktoré odrážajú jedinečnosť prostredia a požiadavky zákazníkov. Ich prístup kombinuje tradičné stavebné techniky s modernými dizajnovými konceptmi, čo zabezpečuje harmonické spojenie medzi architektúrou a prírodným prostredím.
Ateliér PODOBA sa nezaoberá len návrhom budov, ale aj komplexným plánovaním a zohľadňovaním udržateľnosti, čím prispieva k pozitívnemu rozvoju miest a obcí. Ich projekty často zdôrazňujú estetiku a funkčnosť, pričom sa snažia o maximálne využitie dostupného priestoru a zdrojov.","Dobrý deň. Páči sa mi, že v ARCHITEKTONICKY ATELIER PODOBA sa venujete inovatívnemu prístupu k architektúre, ktorý zohľadňuje miesto a jeho okolie, čím vytvárate jedinečné a funkčné prostredia."
Dede Architects - Architektonický ateliér Bratislava,DEDE,https://www.dedearchitects.sk/,+421 949 611 686,Bratislava,Architektonická kancelária,"DEDE je architektonický ateliér so zameraním na vytváranie inovatívnych a funkčných architektonických projektov. S viac ako šiestimi rokmi skúseností ponúkajú široké portfólio služieb vrátane návrhu rodinných domov, rekonštrukcií a komerčných priestorov, pričom kladú dôraz na moderné a technicky overené riešenia. Ich tím odborníkov zaručuje jedinečné a kvalitné výsledky, pričom sa snažia zabezpečiť hladký priebeh celého procesu od návrhu po realizáciu.","Dobrý deň. Páči sa mi, že v DEDE sa venujete kreatívnemu a jedinečnému prístupu k architektúre, ktorý je zameraný na detail a funkčnosť. Váš záväzok k moderným a nadčasovým riešeniam ma zaujal a rád by som sa dozvedel viac o možnostiach spolupráce."
"A-typ, architektonický ateliér, spol. s r.o.","A-typ, architektonický ateliér",https://www.a-typ.sk/,+421 51/748 19 37,"Nižná Šebastová, Prešov",Architekt,"A-typ, architektonický ateliér s.r.o. je renomovaný ateliér so sídlom v Prešove, ktorý sa špecializuje na komplexnú projektovú prípravu stavieb pozemného staviteľstva. Ich portfólio zahŕňa široké spektrum služieb od návrhu verejných priestranstiev až po interiérový dizajn, pričom dbajú na vysokú kvalitu a funkčnosť.","Dobrý deň. Páči sa mi, že v A-typ, architektonický ateliér sa venujete tvorbe inovatívnych projektov, ktoré kombinujú estetiku s praktickým využitím."
Architektonický Ateliér - Proka Projekt Sojáková & Kapitán,Architektonický Ateliér,,+421 2/622 485 92,Bratislava,Firemná kancelária,,
Architektonický ateliér AŽ PROJEKT,Architektonický ateliér AŽ PROJEKT,http://www.azprojekt.sk/,+421 2/455 238 96,Zálesie,Architekt,"Architektonický ateliér AŽ PROJEKT sa zameriava na komplexné služ­by v oblasti architektúry, urbanizmu a územného plánovania. Vďaka svojim skúsenostiam navrhujú regiónálne koncepcie a územné plány miest a obcí, ktoré zabezpečujú ich udržateľný rozvoj.
Ateliér sa pyšní dvoma ocenením CE ZA AR, čo svedčí o ich odbornej kompetencii a inovatívnom prístupe k navrhovaniu. Krajinné a územné štúdie, ktoré realizujú, sú dôkazom ich nasadenia pri zachovaní a zlepšovaní kvality životného prostredia v mestských aj vidieckych oblastiach.","Dobrý deň. Páči sa mi, že v Architektonickom ateliéru AŽ PROJEKT sa venujete navrhovaniu regionálnych koncepcií a územným plánom miest a obcí, čím prispievate k ich udržateľnému rozvoju a harmonickému rozvoju krajiny."
Architektonický a projektový Ateliér,Architektonický a projektový Ateliér,,+421 907 230 211,Trenčín,Firemná kancelária,,
archiCENTRUM | Architektonický ateliér Púchov,archiCENTRUM,http://www.archicentrum.sk/,+421 907 482 181,Púchov,Architektonická kancelária,no content,
Proj3kt.sk - Architektonický atelier,Proj3kt,http://www.proj3kt.sk/,+421 948 736 007,Jasenica,Architekt,"Architektonický ateliér Proj3kt sa špecializuje na komplexné architektonické služby, vrátane architektonických štúdií, technickej dokumentácie a inžinierskej činnosti. S dôrazom na precíznosť, zodpovednosť a flexibilitu pristupujú k každý projekt, čo zaručuje jedinečné dielo pre každého klienta. Ich skúsenosti a profesionálny prístup sú potvrdené pozitívnymi referenciami spokojných zákazníkov, ktorí ocenili nielen kvalitu výkonu, ale aj osobný prístup a nadšenie tímu.","Dobrý deň. Páči sa mi, že v Proj3kt sa venujete detailnému analyzovaniu požiadaviek a plánov stavieb, čo prispieva k presnosti a kvalite vašich projektov."
"kontra architekti, s.r.o. - Architektonický a projekčný ateliér",kontra architekti,https://www.karch.sk/,+421 918 963 421,Tvrdošín,Architektonická kancelária,"Kontra Architekti je architektonický a projekčný ateliér, ktorý sa zameriava na individuálne a kvalitné projekčné služby. Cieľom tímu je zabezpečiť, aby každý projekt spĺňal požiadavky zákazníka s maximálnym dôrazom na detail a funkčnosť, pričom sa využíva inovatívna technológia BIM na efektívne spracovanie projektovej dokumentácie. Ateliér ponúka široké spektrum služieb, od realizácie rekreačných komplexov až po návrhy rodinných domov, pričom kladie dôraz na nízkoenergetické a pasívne riešenia zastavaných plôch.","Dobrý deň. Páči sa mi, že v Kontra Architekti sa venujete profesionálnemu prístupu a kvalite vo všetkých etapách projektovania. Váš záväzok k vytváraniu funkčne a esteticky príťažlivých priestorov je naozaj obdivuhodný."
"architekton s.r.o. | Architektonický ateliér Martin, Žilina, SR",architekton,http://www.architekton.sk/,+421 903 234 062,Martin,Architekt,"Architekton je architektonický ateliér so sídlom v Martine, ktorý sa zameriava na vytváranie originálnych a kreatívnych návrhov pre interiér a exteriér. Naša ponuka zahŕňa projekty rôznych typov, od rodinných domov po administratívne budovy, pričom prioritou je spokojnosť zákazníka a vysoká kvalita služieb. Naši odborníci zabezpečujú kompletnú podporu od architektonickej štúdie až po realizáciu, pričom dbajú na detail a individuálne potreby klientov.","Dobrý deň. Páči sa mi, že v architekton sa venujete originálnym a inšpiratívnym návrhom architektúry, ktoré sú praktické a funkčné. Vaša snaha o osobitný prístup ku každému projektu a váš dôraz na kvalitu sú veľmi pôsobivé."
Elektrikár - Csaba Bóna,Elektrikár,,+421 907 765 685,Bátorove Kosihy,Elektrikár,,
RSA Projekt - Alena Stašková,RSA,,+421 903 230 855,Štúrovo,Obchod,,
"BredaStav, spol. s r.o.",BredaStav,,+421 36/752 21 77,Mužla,Stavebný inžinier,,
Rv Sound,RV,https://www.rvsound.eu/,+421 918 979 682,Gbelce,Technik,"Spoločnosť RV Sound sa od roku 2011 špecializuje na realizáciu rôznych podujatí, ktoré zahŕňajú zvukovú, svetelnú a pódiovú techniku. Sme odhodlaní zabezpečiť vysokú kvalitu našich služieb a maximálne uspokojiť požiadavky našich klientov, či už ide o menšie rodinné oslavy, firemné akcie alebo veľké festivaly.","Dobrý deň. Páči sa mi, že v RV Sound sa venujete komplexnému pokrytiu technických požiadaviek pre rôzne typy podujatí, čo určite prispieva k ich bezproblémovému priebehu a úspechu."
