title,company_name_reworked,website,phone,city,category,abstract,ai_first_sentence
Nábytok Eliška,Nábytok Eliška,https://eliska.sk/,+421 905 709 801,Nové Zámky-Dolná kapsa,Výrobca nábytku,"Nábytok ELIŠKA je renomovaná firma, ktorá sa špecializuje na kompletné zariadenie bytov, domov a kancelárií. S rozsiahlym sortimentom produktov vrátane obývacích zostáv, detského nábytku a zakázkovej výroby nábytku, si kladie za cieľ uspokojiť potreby každého klienta. Našim zákazníkom poskytujeme návrh, zameranie a montáž priamo u nich, čím zabezpečujeme individuálny prístup a kvalitné služby. Firma si zakladá na kvalitných materiáloch a profesionálnom servise, čo dokazuje aj množstvo spokojných zákazníkov.  
Nábytok ELIŠKA sa nachádza na Komárňanskej ceste 3 v Nových Zámkoch a je otvorený od pondelka do piatka a v sobotu do obeda. Firma spolupracuje s renomovanými značkami, čím zaručuje vysokú kvalitu ponúkaného tovaru a služieb. Cieľom je nielen predaj nábytku, ale aj komplexné riešenie priestoru, aby každý domov alebo kancelária spĺňali estetické aj praktické požiadavky klienta.","Dobrý deň. Páči sa mi, že v Nábytku ELIŠKA sa venujete individuálnemu prístupu k zákazníkom, čo je v súčasnosti veľmi dôležité. Váš dôraz na kvalitné materiály a profesionálnu montáž priamo u zákazníka svedčí o vašej zodpovednosti a odbornej zdatnosti v oblasti zariadenia interiérov."
New Design - nábytok na mieru - výroba,NEW,https://newdesign.sk/,+421 905 548 131,Plavecký Mikuláš,Výrobca nábytku,"Firma New Design sa od roku 2002 špecializuje na výrobu nábytku na mieru, pričom sa zameriava na kompletné interiérové realizácie s ohľadom na estetiku a funkčnosť. Ich tím odborníkov zabezpečuje, že každý kus nábytku je navrhnutý na základe individuálnych potrieb zákazníka a architektonických projektov, čím efektívne vyplní priestor a zvýši kvalitu bývania.","Dobrý deň. Páči sa mi, že v NEW sa venujete výrobe dizajnového nábytku na mieru, ktorý zohľadňuje individuálne požiadavky zákazníkov. Vaša dlhoročná prax v branži a zameranie na kvalitu a estetiku z Vás robia dôveryhodného výrobcu."
Ďuriš- VÝROBA NÁBYTKU,Ďuriš- VÝROBA NÁBYTKU,https://duris-vyroba-nabytku1.webnode.sk/?_gl=1*w11x4p*_gcl_au*NDY4NDYxOTY0LjE3NTA4MzIyNjYuMTM4MzUwOTYwNC4xNzUwODM3NzAxLjE3NTA4Mzc3MzM.,+421 905 347 681,Zbehy,Stolárstvo,"Spoločnosť Ďuriš- VÝROBA NÁBYTKU, rodinná firma s dlhoročnou tradíciou, sa špecializuje na výrobu kvalitného nábytku na mieru. Ich prístup k zákazníkom je založený na precíznosti a osobnom prístupe, pričom využívajú moderné technológie a najkvalitnejšie materiály, aby splnili očakávania svojich klientov.","Dobrý deň. Páči sa mi, že v Ďuriš- VÝROBA NÁBYTKU sa venujete výrobe nábytku na mieru s dôrazom na kvalitu a precíznosť. Vaša schopnosť prispôsobiť dizajn presne podľa predstáv zákazníkov ma veľmi oslovila."
KRAFT - NÁBYTOK NA MIERU,KRAFT,http://www.kraftnabytok.sk/,+421 914 195 522,Dolný Hričov,Stolárstvo,"Kraft nábytok sa špecializuje na výrobu nábytku na mieru, pričom kladie dôraz na kvalitu a precíznosť spracovania. Ich široká ponuka zahŕňa kuchyne, vstavané skrine, kúpeľňový nábytok a ďalšie prvky interiérového dizajnu, ktoré sú prispôsobené potrebám a preferenciám zákazníkov.","Dobrý deň. Páči sa mi, že v KRAFT sa venujete vytváraniu nábytku na mieru so zameraním na detail a kvalitu, čo odráža vysoké štandardy vo vašej práci."
Bafa Bútor,BAFA,https://ba-fabutor.com/,+421 917 413 529,Chotín,Pracovník s drevom,"S spoločnosťou BAFA sa zaoberáte výrobou na mieru a vytváraním kvalitného nábytku, pričom dbáte na spokojnosť zákazníkov. Zameriavate sa na individuálny prístup ku každému projektu, ponúkate bezplatné konzultácie a moderné 3D vizualizácie, ktoré zjednodušujú proces rozhodovania pre klientov.","Dobrý deň. Páči sa mi, že v BAFA sa venujete vytváraniu osobne prispôsobeného nábytku a s veľkým dôrazom na detail a kvalitu vašich služieb."
Kuks - nábytok na mieru,Kuks,http://www.kuks.sk/,+421 918 760 762,"Revolta, Kremnica",Výrobca nábytku,"Kuks je rodinná firma zaoberajúca sa výrobou nábytku na mieru s dôrazom na moderný dizajn a kvalitu. Služby zahŕňajú 3D vizualizácie, rýchle jednanie a osobné zameranie priamo u zákazníka, čo zabezpečuje optimálne využitie priestoru a individuálny prístup k požiadavkám klientov.","Dobrý deň. Páči sa mi, že v Kuks sa venujete výrobe kvalitného a moderného nábytku na mieru, pričom kladiete dôraz na detail a rýchlu reakciu na požiadavky zákazníkov."
Stolárstvo Provena 🛋️ Kvalita a krása nábytku na mieru v Nitre,Stolárstvo Provena 🛋️ Kvalita a krása nábytku na mieru v Nitre,https://www.provena.sk/,+421 948 917 329,"Dolné Krškany, Nitra",Predajňa nábytku,"Stolárstvo Provena sa špecializuje na výrobu nábytku na mieru s dôrazom na kvalitu a estetický vzhľad. S bohatou tradíciou a výbornými referenciami ponúkajú produkty vyrobené z prvotriednych materiálov, ktoré sú dizajnované tak, aby splnili predstavy každého zákazníka. Klienti môžu očakávať precíznu prácu a individuálny prístup, pričom všetko dielo je zamerané na funkčnosť a dlhú životnosť nábytku.","Dobrý deň. Páči sa mi, že v Stolárstvo Provena sa venujete výrobe nábytku na mieru s dôrazom na kvalitu a detail. Vaša filozofia poctivého remesla a spokojnosti zákazníkov je pre mňa veľmi osviežujúca."
Šiška Nábytok - Výroba a predaj nábytku na mieru,ŠIŠKA,http://www.siskanabytok.sk/,+421 915 219 220,Špačince,Firemná kancelária,Firma ŠIŠKA sa špecializuje na výrobu a predaj nábytku na mieru v Trnave. S dôrazom na kvalitu a precízne spracovanie ponúkajú široké portfólio výrobkov od vstavaných skrín po detské izby.,"Dobrý deň. Páči sa mi, že v ŠIŠKA sa venujete individuálnemu prístupu k zákazníkom a vytvárate jedinečné riešenia, ktoré odrážajú ich osobný štýl a potreby."
Miroslav Záň - výroba nábytku,Miroslav Záň,https://www.zannabytok.sk/,+421 908 715 016,"Priemyselný obvod, Prievidza",Výrobca nábytku,"Miroslav Záň sa špecializuje na výrobu nábytku na mieru podľa individuálnych predstáv zákazníkov. Ponúka komplexné služby od presného zamerania priestoru cez vizualizáciu interiéru až po výrobu a montáž nábytku, pričom kladie dôraz na kvalitu použitých materiálov a kovaní. Vďaka spolupráci s renomovanými dodávateľmi zabezpečuje dlhú životnosť a estetický vzhľad produktov, čím dosahuje vysokú spokojnosť zákazníkov.","Dobrý deň. Páči sa mi, že v Miroslav Záň sa venujete precíznej výrobe nábytku na mieru, čo výrazne prispieva k vytvoreniu jedinečných interiérových priestorov a skvelej atmosféry vo vašich zákazníckych domovoch."
VÝROBA NÁBYTKU BELANEC,VÝROBA NÁBYTKU BELANEC,http://nabytokbelanec.sk/,+421 902 727 413,Miezgovce,Výrobca nábytku,"VÝROBA NÁBYTKU BELANEC je rodinná firma so zameraním na výrobu kvalitného nábytku na mieru, ktorá bola založená v roku 2010. S dôrazom na presnosť a spokojnosť zákazníka ponúka široké spektrum produktov, vrátane vstavaných skríň a kuchynských liniek, so službami, ako sú grafické návrhy a montáž priamo u zákazníka. Firma sa snaží poskytovať individuálny prístup a profesionálne služby, pričom využíva iba kvalitné materiály pre dlhodobú spokojnosť svojich klientov.","Dobrý deň. Páči sa mi, že vo VÝROBA NÁBYTKU BELANEC sa venujete výrobe nábytku na mieru s dôrazom na kvalitu a spokojnosť zákazníkov."
"Nábytok PRESTIGE - predaj nábytku, zákazková výroba nábytku",Nábytok PRESTIGE,http://www.nabytok-prestige.sk/,+421 948 073 123,Ružomberok,Výrobca nábytku,"Nábytok PRESTIGE je renomovaná firma s vyše trojdecétnou tradíciou na slovenskom trhu, ktorá sa špecializuje na zákazkovú výrobu nábytku a ponuku moderného nábytku na mieru. V ich portfóliu nájdete široký výber produktov, od sedacích súprav po jedálenské stoly, pričom dôraz kladú na kvalitu a zákaznícku spokojnosť.","Dobrý deň. Páči sa mi, že v Nábytok PRESTIGE sa venujete zákazkovej výrobe nábytku a ponúkate moderné riešenia pre každú domácnosť, čím zabezpečujete individuálny prístup ku každému zákazníkovi."
Himolla - Selyz s.r.o.,Himolla,http://www.himolla.com/cms2/index.php?id=1&L=5%2Findex.php,,Želiezovce,Výrobca nábytku,"Himolla Polstermöbel GmbH je renomovaný výrobca kvalitných a funkčných čalúnených nábytkov so zameraním na inováciu a udržateľnosť. S viac ako 75-ročnou tradíciou ponúkajú široký sortiment produktov, ktoré sa vyznačujú moderným dizajnom, vysokou kvalitou materiálov a ergonomickou konštrukciou.","Dobrý deň. Páči sa mi, že v Himolla sa venujete designu a kvalite vašich produktov, pričom kombinuje moderné trendy s dlhotrvajúcou funkčnosťou. Taktiež ma oslovila vaša snaha o udržateľnosť a zodpovednosť vo výrobe."
Industriálny nábytok - Kovart,Industriálny nábytok,,+421 918 648 399,Sereď,Výrobca nábytku,,
EMZET výroba nábytku,EMZET,http://www.emzetnr.sk/,+421 905 633 104,"Kynek, Nitra",Výrobca nábytku,no content,
L. A. Wood - Ladislav Jacko,L.,http://www.lawood.sk/,+421 905 896 470,"Dolná kapsa, Nové Zámky",Výrobca nábytku,"Firma L. sa zaoberá inováciami v oblasti technológie a poskytovania služieb, pričom kladie dôraz na kvalitu a efektivitu. S ich odborným tímom sa snažia nájsť jedinečné riešenia pre rozvoj podnikania a zlepšenie zákazníckej skúsenosti.","Dobrý deň. Páči sa mi, že v L. sa venujete inováciám a vytváraniu hodnoty pre zákazníkov prostredníctvom moderných technológií."
Výroba nábytku z masívu,Výroba nábytku z masívu,,+421 915 540 741,Levice,Stolár,,
Coxicont s.r.o.,Coxicont,http://www.coxicont.sk/,+421 907 043 531,Radvaň nad Dunajom,Zámočníctvo,no content,
Otváranie zabuchnutých alebo zamknutých dverí domov a áut - nonstop servis,Otváranie zabuchnutých alebo zamknutých dverí domov a áut,https://zabuchnute.sk/,+421 902 333 887,Petržalka,Zámočníctvo,"Naša spoločnosť sa špecializuje na rýchle a bezpečné otváranie zabuchnutých a zamknutých dverí domov a áut. Poskytujeme služby nonstop v oblastiach ako Bratislava, Brezno, Nitra, Zvolen a mnohých ďalších mestách, pričom garantujeme vysokú odbornú úroveň a spokojných zákazníkov. Naši zámočníci používajú profesionálne náradie, ktoré zabezpečuje otváranie bez poškodenia zámkov alebo karosérie vozidiel, a to aj v kritických situáciách, ako sú víkendy či sviatky.","Dobrý deň. Páči sa mi, že v Otváranie zabuchnutých alebo zamknutých dverí domov a áut sa venujete poskytovaniu rýchlej a efektívnej pomoci počas núdzových situácií, čím zabezpečujete bezpečnosť a pohodu svojich klientov."
OTVORIME.SK – Zámočník Bratislava NONSTOP,OTVORIME,https://otvorime.sk/,+421 903 232 761,Ivanka pri Dunaji,Kľúčová služba,"Firma OTVORIME sa zaoberá poskytovaním profesionálnych služieb v oblasti otvárania zabuchnutých a zamknutých dverí, montáže bezpečnostných dverí a opravy dverí v Bratislave a okolí. S dôrazom na rýchly a efektívny servis ponúkajú aj nonstop havarijnú službu, aby zabezpečili maximálnu spokojnosť a bezpečnosť svojich zákazníkov. Ich tím skúsených zámočníkov disponuje odbornými znalosťami, ktoré sú výsledkom dlhoročnej praxe v oblasti bezpečnostných riešení.","Dobrý deň. Páči sa mi, že v OTVORIME sa venujete poskytovaniu kvalitného servisu v oblasti otvárania dverí a zabezpečenia nehnuteľností. Vaša nonstop dostupnosť a odborné zázemie sú veľmi cenné pre zákazníkov, ktorí sa ocitnú v núdzi."
Zámočník SOS – Otváranie a servis dverí domov a áut. Bratislava a okolie.,Zámočník SOS,https://www.zamocnik-sos.sk/,+421 911 114 646,Petržalka,Zámočníctvo,"Zámočník SOS poskytuje non-stop zámočnícku službu so zameraním na otváranie dverí domov, bytov, áut a trezorov. S dlhoročnou praxou a profesionálnym náradím zabezpečujeme rýchle a spoľahlivé služby za prijateľné ceny.","Dobrý deň. Páči sa mi, že v Zámočník SOS sa venujete odbornému poradenstvu a širokej škále zámočníckych služieb, čo určite ocenia mnohí zákazníci v núdzi."
Zámočník Michal -- ZÁMOČNÍK,Zámočník Michal -- ZÁMOČNÍK,http://www.zamocnik.com/,+421 918 761 155,"Stráňany, Michalovce",Zámočníctvo,"Firma ZÁMOČNÍK poskytuje profesionálne služby otvárania zabuchnutých dverí a automobilov v regióne Trebišov a jeho okolí, vrátane miest ako Michalovce, Košice a Vranov nad Topľou. S dôrazom na kvalitu a spokojnosť zákazníka, spoločnosť disponuje špecializovaným náradím, ktoré zaručuje minimálne poškodenie pri zásahu a krátky čas reakcie na požiadavky klientov.","Dobrý deň. Páči sa mi, že v Zámočník Michal -- ZÁMOČNÍK sa venujete poskytovaniu non-stop služieb v oblasti otvárania zabuchnutých dverí a automobilov, čo určite odbúrava stres pre mnohých zákazníkov v núdzi."
Otváranie zabuchnuté aj zamknuté dvere zámočník klúčová služba Prievidza Handlová Partizánske Nováky,Otváranie zabuchnuté aj zamknuté dvere zámočník klúčová služba Prievidza Handlová Partizánske Nováky,https://www.zeleziarstvodomov.sk/zeleziarstvo-naradie-doprava/klucova-sluzba-otvaranie-zabuchnutych-dveri,+421 905 320 312,"Močidlá, Prievidza",Zámočníctvo,"V oblasti zabezpečenia majetku a zaisťovania prístupu do priestorov je dôležitým partnerom firma Otváranie zabuchnuté aj zamknuté dvere zámočník klúčová služba Prievidza Handlová Partizánske Nováky. S odbornými znalosťami a širokou ponukou služieb zabezpečuje akútnu pomoc v prípadoch zabuchnutých alebo zamknutých dverí, a to rýchlo a efektívne. Klienti si môžu byť istí, že ich problémy s dverami budú vyriešené odborníkmi s bohatými skúsenosťami v tejto oblasti.","Dobrý deň. Páči sa mi, že v Otváranie zabuchnuté aj zamknuté dvere zámočník klúčová služba Prievidza Handlová Partizánske Nováky sa venujete rýchlemu a profesionálnemu riešeniu problémov so zamknutými dverami, čo je v dnešnej dobe mimoriadne dôležité pre zabezpečenie bezpečnosti majetku a pohodlia užívateľov."
KĽÚČOVÁ SLUŽBA - Figolock,KĽÚČOVÁ SLUŽBA,https://figolock.sk/,+421 907 737 756,Nové Zámky,Kľúčová služba,"KĽÚČOVÁ SLUŽBA, so sídlom v Nových Zámkoch a Komárne, poskytuje široké spektrum zámočníckych služieb vrátane výroby kľúčov, otvárania dverí a áut, ako aj servisu dverí a okien. S viac ako 25-ročnými skúsenosťami, firma sa zameriava na profesionálne a rýchle riešenia bez poškodenia majetku klientov. Ich produkty sú dostupné vrátane širokého sortimentu zámkov a ďalších zabezpečovacích prvkov, čo z nich robí ideálneho partnera pre individuálne aj komerčné potreby v oblasti zabezpečenia.","Dobrý deň. Páči sa mi, že v KĽÚČOVÁ SLUŽBA sa venujete profesionálnemu servisu v oblasti výroby a oprav zámkov, ako aj bezproblémovému otváraniu dverí a áut. Vaša odbornosť a 24/7 dostupnosť sú určite veľmi hodnotné pre Vašich klientov."
DOKTOR DVERE - Kľúčová služba Nové Zámky,DOKTOR,https://www.doktordvere.sk/,+421 940 920 100,,Kľúčová služba,"DOKTOR poskytuje komplexné služby v oblasti otvárania a servisu dverí a okien v Nových Zámkoch a okolí. S odbornými skúsenosťami a nonstop dostupnosťou zabezpečujeme rýchle a efektívne riešenia pre našich zákazníkov, ktorí ocenia našu profesionalitu a ústretovosť. Naša dlhoročná prax a kvalitné služby sú zárukou spokojnosti všetkých klientov.","Dobrý deň. Páči sa mi, že v DOKTOR sa venujete komplexným a profesionálnym službám v oblasti dverí a okien, pričom zabezpečujete aj rýchlu pomoc v núdzových situáciách."
ZAMaKOV - IVANIČ DUŠAN,ZAMaKOV,,+421 915 114 309,Semerovo,Dodávateľ plotov,,
Peter Pajkoš - Zámky,PETER,https://zamocnik-kosice.sk/,+421 905 757 418,Košice,Remeslá,"Zámočníctvo Peter Pajkoš poskytuje komplexný zámočnícky servis v Košiciach a okolí. V rámci svojich služieb sa špecializuje na otváranie zabuchnutých dverí a áut, montáž a servis zámkov, ako aj núdzové zabezpečenie po vlúpaní. S dôrazom na spokojnosť zákazníka, ponúka kvalitné a profesionálne služby s garanciou. V súvislosti s plánovanými letnými dovolenkami je potrebné upozorniť na obmedzenú dostupnosť služieb v uvedených termínoch.","Dobrý deň. Páči sa mi, že v PETER sa venujete kvalitným zámočníckym službám a zameriavate sa na spokojnosť svojich zákazníkov. Rád by som sa dozvedel viac o vašich možnostiach spolupráce."
Kolembus Peter - Zámočnícke Práce,Kolembus Peter,http://www.kolembus-nz.sk/,+421 35/641 21 16,"Pri Bani, Nové Zámky",Spoločnosť vyrábajúca kovové konštrukcie,"Firma Kolembus vznikla v roku 2002 a od tej doby sa jej pôsobnosť na trhu neustále rozrastá. Zameriava sa na výrobu a montáž širokého spektra výrobkov v oblasti zámočníctva, pričom kladie dôraz na kvalitu, precíznosť a dodržiavanie dodacích termínov. Klienti majú možnosť výberu z rôznych produktov, vrátane oceľových konštrukcií, brán, mreží a schodov, pričom sa firma prispôsobuje individuálnym požiadavkám zákazníka.","Dobrý deň. Páči sa mi, že v Kolembus Peter sa venujete výrobe a montáži kvalitných oceľových konštrukcií a rôznych zámočníckych produktov, čo potvrdzuje Vašu odbornosť a dôvtip pri uspokojovaní potrieb zákazníkov."
Zámočník,Zámočník,https://zamocnik-kosice.sk/kontakt/,+421 905 757 418,Sídlisko KVP,Obchod,"Zámočníctvo Peter Pajkoš poskytuje komplexný zámočnícky servis v meste Košice a okolí, pričom sa zameriava na precízne a kvalitné služby. Firma je známa svojou dostupnosťou a spoľahlivosťou, pričom si zakladá na individuálnom prístupe ku každému zákazníkovi, čím zabezpečuje ich maximálnu spokojnosť.","Dobrý deň. Páči sa mi, že v Zámočník sa venujete poskytovaniu kvalitných služieb v oblasti zámočníctva a kladiete dôraz na spokojnosť svojich zákazníkov."
"SOS ZÁMOČNÍK ZÁHORIE - núdzové otváranie dverí bytov, domov a automobilov",SOS,https://sos-zamocnik-zahorie.sk/,+421 911 766 776,Radošovce,Núdzové zámočnícke služby,"SOS Zámočník Záhorie poskytuje rýchle a odborné služby v oblasti núdzového otvárania dverí pre byty, domy a automobily. Ich činnosť pokrýva celé západné Slovensko, pričom prioritou je vyriešiť problémy klientov s maximálnou precíznosťou a bez poškodenia. Služby zahŕňajú otvorenie zabuchnutých dverí, výrobu autokľúčov, opravy zámkov a zabezpečenie dverí po vlámaní, pričom zákazníci oceňujú rýchlosť a kvalitu poskytovaných služieb.","Dobrý deň. Páči sa mi, že v SOS sa venujete profesionálnemu a rýchlemu núdzovému otváraniu dverí, čo je v dnešnej dobe veľmi dôležité."
Zámočník,Zámočník,,+421 911 416 144,Bratislava,Údržbárske služby,,
Zamočník Mimbelli,Zamočník Mimbelli,https://www.zamocnikmimbelli.sk/,+421 948 056 769,,Zámočníctvo,"Zamočník Mimbelli je renomovaná spoločnosť, ktorá poskytuje široké spektrum služieb v oblasti otvárania zámkov a bezpečnostných dverí s dôrazom na rýchlosť a kvalitu. Naša firma pôsobí v Bratislave, Žiline, Košiciach a Prešove, pričom garantujeme príchod technika do 15-25 minút a najmodernejšie metódy bez poškodenia dverí či zámkov. Naši odborníci majú dlhoročné skúsenosti a sú certifikovaní na všetky typy služieb, čo zaručuje vysokú úroveň profesionálnosti a spokojnosť našich zákazníkov.

Pre našich klientov poskytujeme aj služby v oblasti výmeny a opravy zámkov, otvorenie trezorov, a taktiež poradenstvo v oblasti zabezpečenia ich majetku. Pri nasadení našich služieb dbáme na transparentnosť a cenovú dostupnosť, pričom konečné ceny sú klientom vždy dopredu odsúhlasené. Naše snaženie je zamerané na to, aby ste sa cítili bezpečne a bezstarostne v akýchkoľvek situáciách vyžadujúcich zásah zámočníka.","Dobrý deň. Páči sa mi, že v Zamočník Mimbelli sa venujete otváraniu zámkov a bezpečnostných dverí s dôrazom na kvalitu a profesionalitu. Vaša ochota poskytnúť pomoc 24 hodín denne a rýchlosť príchodu technika sú určite výnimočné aspekty, ktoré zákazníci ocenia."
Otváranie dverí Bratialava Zámočník Bratislava Zabuchnuté dvere Výroba a kódovanie autokľúčov Locksmith SOS Servis,Otváranie dverí Bratialava Zámočník Bratislava Zabuchnuté dvere Výroba a kódovanie autokľúčov Locksmith SOS Servis,https://otvaraniedveribratislava.sk/,+421 910 646 444,,Zámočníctvo,"Služby spoločnosti Otváranie dverí Bratislava sa zameriavajú na rýchle a profesionálne riešenie problémov s dverami a zámkami. Ich portfólio zahŕňa otváranie zabuchnutých dverí, výrobu a kódovanie autokľúčov, ako aj opravy a výmeny zámkov a kovania. Vďaka nonstop službám sú vždy pripravení zasiahnuť a vyriešiť akúkoľvek situáciu, ktorá si vyžaduje odborný zásah.","Dobrý deň. Páči sa mi, že v Otváraní dverí Bratislava Zámočník Bratislava sa venujete komplexnému servisu v oblasti otvárania dverí a zámkov, čím pomáhate mnohým zákazníkom, ktorí sa ocitnú v nepríjemnej situácii so zamknutými dverami alebo potrebou náhrady zámkov."
Bobby - Róbert Zámočník,Bobby,,+421 905 182 358,Sasinkovo,,,
MoSaZ Mišík Miroslav,MOSAZ,,+421 37/783 35 71,Vráble,,,
Joalko S.r.o.,Joalko,http://www.joalko.sk/,+421 35/760 40 00,Hurbanovo,Výrobca nábytku,"Spoločnosť Joalko ponúka jednoduché a rýchle riešenia pre vytváranie webových stránok prostredníctvom platformy inPage. Užívatelia môžu využívať administráciu a sprievodcu, ktorý im pomáha vytvoriť základnú štruktúru a vzhľad svojich stránok v priebehu niekoľkých minút. Navyše, platforma poskytuje profesijné šablóny a množstvo užitočných tipov a trikov v blogu, čo uľahčuje proces pre začiatočníkov aj skúsených používateľov.","Dobrý deň. Páči sa mi, že v Joalko sa venujete poskytovaniu efektívnych a prístupných nástrojov pre vytváranie webových stránok, čo výrazne zjednodušuje cestu podnikateľov k online prezentácii ich služieb a produktov."
Wood Musky,WOOD,http://www.woodmusky.de/,,,Výrobca nábytku,no content,
Kovovýroba a zámočnícke práce B.M.P.,Kovovýroba a zámočnícke práce B.M.P.,,+421 42/469 20 82,Mestečko,,,
Jozef Matula - Zámočnícke práce,JOZEF,,+421 905 853 176,Sever,,,
Zámočníctvo Juraj Perczel,Zámočníctvo Juraj Perczel,,+421 907 708 348,Komárno,,,
ZZZámočníctvo s.r.o.,ZZZámočníctvo,http://www.zzzamocnictvo.sk/,+421 904 808 055,Levice,Zámočníctvo,"Firma ZZZámočníctvo s.r.o. sa špecializuje na výrobu a dodávku kvalitných produktov, akými sú brány, prístrešky, schody a zábradlia. S dôrazom na precíznosť a spokojnosť zákazníkov prinášame rôzne kovové výrobky z železa, ocele a nerezu, pričom dbáme na dodržiavanie dohodnutých termínov a férové ceny. Naša bohatá galéria ponúka ukážky našich realizácií, čo potvrdzuje našu odbornosť a kvalitu našich služieb, na ktorú sa môžete spoľahnúť.","Dobrý deň. Páči sa mi, že v ZZZámočníctvo sa venujete širokej ponuke kovových výrobkov, od zábradlí a brán po schody a bytové doplnky, pričom sa snažíte splniť všetky želania a požiadavky svojich zákazníkov."
Vladimír Zajac - zváranie a zámočnícke práce - Turčianske Teplice,Vladimír Zajac,,+421 905 860 329,Turčianske Teplice,Zvárač,,
"Zámočnícke práce, zámočníctvo - Norbert Lobotka","Zámočnícke práce, zámočníctvo",http://www.zamocnictvobn.sk/,+421 908 886 260,Bánovce nad Bebravou,Obchod,"Zámočnícke práce, vedené pánom Norbertom Lobotkom, sa nachádzajú v Bánovciach nad Bebravou a ponúkajú široké spektrum služieb v oblasti kovovýroby a zámočníctva. Firma sa špecializuje na výrobu brán, plotov, schodov, zábradlí a rôznych konštrukcií, pričom garantuje kvalitné a atypické riešenia prispôsobené potrebám zákazníka. Okrem toho zabezpečuje aj montážne a strojné práce vrátane zvárania, rezania a sústruženia, čo ju robí komplexným dodávateľom pre priemyselné aj súkromné projekty.","Dobrý deň. Páči sa mi, že v Zámočnícke práce, zámočníctvo sa venujete tak širokému spektru služieb v oblasti kovovýroby a zámočníctva, čím dokážete uspokojiť rôzne potreby klientov v Bánovciach nad Bebravou."
