title,company_name_reworked,website,phone,city,category,abstract,ai_first_sentence
ArtGips - sadrokartónové systemy,ArtGips,http://www.artgips.sk/,+421 908 991 882,Košice,Špecialista na sádrokartónové priečky,"Firma ArtGips sa špecializuje na dodávku a montáž sadrokartónových systémov, pričom sa zameriava na kvalitné spracovanie a individuálne riešenia pre svojich klientov. S bohatými skúsenosťami v oblasti zariaďovania interiérov vytvárajú atraktívne a funkčné priestory, ktoré zodpovedajú požiadavkám moderného bývania.","Dobrý deň. Páči sa mi, že v ArtGips sa venujete inovatívnym riešeniam v oblasti sadrokartónových systémov a pomáhate klientom realizovať ich vízie interiérov."
LEMARCK Slovakia s.r.o.,LEMARCK Slovakia,https://www.sadrokarton.sk/,+421 905 272 672,"Dolná kapsa, Nové Zámky",Stavebniny,"Spoločnosť LEMARCK Slovakia sa špecializuje na dodávku a montáž sadrokartónových systémov, kazetových stropov a tepelných izolácií. Jej produkty nachádzajú široké uplatnenie v moderných stavbách, čo umožňuje efektívnu a cenovo prijateľnú realizáciu projektov. Ponúkajú profesionálny zákaznícky servis, odborné poradenstvo a široký sortiment materiálov s dôrazom na kvalitu a inováciu.","Dobrý deň. Páči sa mi, že v LEMARCK Slovakia sa venujete poskytovaniu komplexných riešení v oblasti sadrokartónových systémov a tepelných izolácií. Vážim si, že kladiete dôraz na kvalitu a odbornosť vo všetkých aspektoch Vašich služieb."
Juraj Kaderábek O & K - Gipsmont,JURAJ,http://www.gipsmont.sk/,+421 905 606 368,Nové Zámky,Špecialista na sádrokartónové priečky,"JURAJ Kaderábek O & K – Gipsmont sa špecializuje na inovatívne sadrokartonové systémy a kazetové stropy, ktoré transformujú interiéry a zlepšujú ich funkčnosť a estetiku. Spoločnosť ponúka komplexné služby od návrhu až po realizáciu, pričom sa sústreďuje na spokojnosť zákazníka a jeho individuálne požiadavky.","Dobrý deň. Páči sa mi, že v JURAJ sa venujete kvalitným sadrokartonovým riešeniam, ktoré premenia akýkoľvek priestor na moderný a funkčný. Vaša dôraz na dizajn a kvalitu sú pre mňa veľmi inšpirujúce."
"GIPSOL, s.r.o.",GIPSOL,https://gipsol.sk/,+421 2/534 192 84,Ružinov,Stavebniny,"GIPSOL s.r.o. je renomovaný predajca sadrokartónových systémov a stavebnín, ktorý sa zameriava na poskytovanie kvalitných materiálov a odborného poradenstva svojim zákazníkom. Spoločnosť ponúka širokú škálu produktov, vrátane sadrokartónových konštrukcií, kazetových stropov a tepelných a zvukových izolácií, pričom zabezpečuje atraktívne ceny a individuálny prístup ku každému zákazníkovi.","Dobrý deň. Páči sa mi, že v GIPSOL sa venujete kvalitným sadrokartónovým systémom a stavebninám, a oceňujem váš individuálny prístup k potrebám zákazníkov."
Sadrokartónové systémy Košice,Sadrokartónové systémy Košice,http://www.artgips.sk/-sadrokartonove-prace-kontakt,+421 908 991 882,Košice,Stavebniny,"Spoločnosť Sadrokartónové systémy Košice sa špecializuje na poskytovanie profesionálnych riešení v oblasti sadrokartónových systémov, ktoré pomáhajú zvyšovať estetiku a funkčnosť interiérov. Ich prístup k realizácii projektov kombinuje kvalitné materiály s odborným remeselným spracovaním, čo vedie k spokojnosti zákazníkov a dlhodobej životnosti výsledných produktov.","Dobrý deň. Páči sa mi, že v Sadrokartónové systémy Košice sa venujete kvalite a detailu vo vašich realizáciách, čo je pre moderné interiéry kľúčové."
Montáž sadrokartónu SDK-pro s.r.o.,Montáž sadrokartónu SDK-pro,http://www.sadrokartonsdkpro.sk/,+421 952 262 411,Poprad,Stavebná firma,"Naša spoločnosť sa špecializuje na profesionálnu montáž sadrokartónu, pričom ponúkame široké spektrum služieb od inštalácie priečok a stropov až po podkrovné úpravy. S dôrazom na kvalitu a spokojnosť našich klientov používame prvotriedne materiály, čím zabezpečujeme dlhodobú funkčnosť a estetiku vašich priestorov. Naši odborníci sa pravidelne zúčastňujú školení, aby boli oboznámení s najnovšími trendmi a technológiami v oblasti sadrokartónového stavia.","Dobrý deň. Páči sa mi, že v Montáž sadrokartónu SDK-pro sa venujete profesionálnym službám, ktoré zohľadňujú estetické a funkčné požiadavky zákazníkov. Rád by som sa dozvedel viac o vašich inováciách a prístupe k montáži sadrokartónových konštrukcií."
MONTÁŽ SADROKARTÓNU Žilina,MONTÁŽ SADROKARTÓNU Žilina,,+421 903 440 365,Žilina-Vlčince,Stavebná firma,,
Montáže sadrokartónu,Montáže sadrokartónu,,+421 917 048 484,Vinohrady nad Váhom,Stavebná firma,,
Trockenbaueri - montáž sadrokartonu,Trockenbaueri,http://trockenbaueri.sk/,+421 911 862 136,Trnava,Stavebné služby,"Firma Trockenbaueri sa špecializuje na montáž sadrokartónových systémov a kompletné interiérové prerábky, pričom si zakladá na detailoch a kvalite realizácie. Sústredí sa na vytváranie moderných a funkčných priestorov, ktoré spĺňajú priania klientov a zabezpečujú ich spokojnosť.","Dobrý deň. Páči sa mi, že v Trockenbaueri sa venujete komplexným interiérovým prerábkam a montáži sadrokartónu s dôrazom na detaily a spokojnosť klientov."
Lukáš Sentinek - Montáž sadrokartónu,LUKÁŠ,,+421 948 517 820,Studienka,Špecialista na sádrokartónové priečky,,
Charlie sadrokartón,Charlie sadrokartón,https://sadrokartonar.sk/,+421 940 787 299,,Stavebná firma,"Spoločnosť Charlie sadrokartón sa špecializuje na profesionálnu montáž sadrokartónu a suchých podláh v Bratislave a okolí. S viac ako 20-ročnou praxou zabezpečujeme kvalitne odvedenú prácu pri realizácii projektov ako sú priečky, stropy a atypické konštrukcie. Naša precíznosť a trpezlivosť sú zárukou spokojnosti našich zákazníkov.","Dobrý deň. Páči sa mi, že v Charlie sadrokartón sa venujete precíznej montáži sadrokartónu a skutočne dbáte na kvalitu a spokojnosť svojich zákazníkov."
Chamraz - montáž sadrokartónu,Chamraz,,+421 905 606 613,Kuchyňa,Stavebná firma,,
Richard Slíž RICOSTAV,Richard Slíž RICOSTAV,https://www.ricostav.sk/,+421 903 395 891,Nitra,Špecialista na sádrokartónové priečky,no content,
RH Dry Mont. s.r.o,RH,,+421 910 637 147,"Sanka, Hatné",Špecialista na sádrokartónové priečky,,
Olekšák - MALIARSTVO* NATIERAČSTVO* TAPETOVANIE* MONTÁŽ SADROKARTÓNU* DOKONČOVACIE STAVEBNÉ PRÁCE,Olekšák,http://www.monttatry.sk/,+421 905 976 663,Kežmarok,Maliar,"Firma Olekšák sa zameriava na kvalitnú výrobu a dodávku stavebných materiálov, pričom dbá na ekologické a udržateľné postupy. V súčasnosti je považovaná za lídra v oblasti inovácie a technológie, čím zabezpečuje vysokú kvalitu svojich produktov a služieb.","Dobrý deň. Páči sa mi, že v Olekšák sa venujete výrobe stavebných materiálov s dôrazom na ekologické a udržateľné prístupy, čo je v súčasnosti veľmi dôležité pre ochranu nášho životného prostredia."
Montáž sadrokartónu Martin Lejsal,Montáž sadrokartónu Martin Lejsal,,+421 903 444 858,Kysucké Nové Mesto,Stavebná firma,,
Adam Jablonski,ADAM,https://www.adamjablonsky.sk/,+421 948 176 747,Sebedín - Bečov,Stavebné služby,"Firma ADAM, so sídlom v Banskej Bystrici, sa zaoberá komplexnými rekonštrukciami bytov a domov. S viac ako 15-ročnými skúsenosťami ponúkajú široké spektrum služieb, vrátane montáže sadrokartónu, pokládky podláh a rekonštrukcie kúpeľní. Adama Jablonského, zakladateľa firmy, charakterizuje precíznosť, profesionalita a dôraz na spokojnosť zákazníkov.","Dobrý deň. Páči sa mi, že v ADAM sa venujete komplexným rekonštrukciám bytov a domov, pričom dbáte na kvalitné spracovanie a spokojnosť zákazníkov. Rád by som sa dozvedel viac o vašich službách a možnostiach spolupráce."
VYSTIERKUJEME TO - Stierkovanie v Bratislave a okolí,VYSTIERKUJEME TO,https://www.vystierkujemeto.sk/,+421 949 652 776,Bratislava,Maliar,"Firma VYSTIERKUJEME TO sa špecializuje na profesionálne stierkovanie a maľovanie interiérov v Bratislave a jej okolí. S viac ako 7-ročnými skúsenosťami ponúkajú precízne a rýchle služby, ktoré zaručujú krásne hladké steny a maximálnu spokojnosť klientov. Ich prístup je založený na kvalite a detailoch, pričom sa snažia o čo najnižší stres pre svojich zákazníkov. Vyskúšajte služby VYSTIERKUJEME TO a užite si výsledok, ktorý presne splní vaše predstavy o dokonalých priestoroch.","Dobrý deň. Páči sa mi, že vo VYSTIERKUJEME TO sa venujete transformácii priestorov a vaša filozofia zameraná na detail a kvalitu je veľmi pôsobivá. Rád by som sa dozvedel viac o vašich službách a možnostiach spolupráce."
"Srňanský Peter - Maliarstvo, Stierkovanie a Montáž sadrokartónu",Srňanský Peter,http://maliar-tt.webnode.sk/,+421 911 160 979,"Modranka, Trnava",Maliar,"Firma Srňanský Peter sa špecializuje na široké spektrum maliarskych, natieračských, tapetovacích a sadrokartonových prác. S dôrazom na kvalitu a odborné zručnosti zabezpečuje zodpovedné a spoľahlivé poskytovanie služieb, pričom využíva len najkvalitnejšie materiály od renomovaných výrobcov. Zákazníci si cení jeho profesionalitu, pričom veľa z nich sa k nemu neustále vracia, čo dokazuje ich spokojnosť s poskytovanými službami.","Dobrý deň. Páči sa mi, že v Srňanský Peter sa venujete širokému spektru maliarskych a natieračských prác, pričom kladete veľký dôraz na kvalitu použitých materiálov a spokojnosť vašich zákazníkov."
TOPMAL s.r.o.,TOPMAL,https://www.topmal.sk/,+421 903 128 533,Bratislava,Maliar,"Spoločnosť TOPMAL sa špecializuje na profesionálne maliarske a rekonštrukčné práce v Bratislave a jej okolí. Naši odborníci ponúkajú široké spektrum služieb, od maľovania a stierkovania po komplexné interiérové rekonštrukcie, pričom kladú dôraz na spokojnosť zákazníka a kvalitu vykonanej práce. S viac ako desaťročnou tradíciou sa firma pýši bohatým portfóliom realizovaných projektov, vrátane spolupráce s renomovanými inštitúciami a obchodnými partnermi.

TOPMAL sa tiež zameriava na používanie kvalitných materiálov a dodržiavanie technologických postupov, čo zabezpečuje dlhodobú trvanlivosť a estetiku výsledkov. Ceny sú nastavené tak, aby odrážali kvalitu a efektivitu, pričom zákazníci sú vždy oboznámení s cenovými podmienkami ešte pred začiatkom realizácie. Tím odborníkov je pripravený splniť požiadavky akéhokoľvek projektu a priniesť do interiérov jedinečný estetický a funkčný vzhľad.","Dobrý deň. Páči sa mi, že v TOPMAL sa venujete širokej škále maliarskych a rekonštrukčných prác s dôrazom na kvalitu a spokojnosť zákazníkov. Verím, že Vaša odbornosť a dlhoročné skúsenosti prispievajú k efektívnej realizácii projektov v oblasti interiérových úprav."
Stavbach s.r.o.,Stavbach,https://www.riesimebyty.sk/,+421 944 637 636,Ružinov,Stavebná firma,"Spoločnosť Riešime byty sa špecializuje na rekonštrukciu bytov v Bratislave, ponúkajúca komplexné služby vrátane modernizácie bytového jadra, elektroinštalácie, vodoinštalácie a maľovania. S profesionálnym tímom a kvalitnými materiálmi zabezpečujú plynulý priebeh prác a vysokú úroveň uspokojenia klientov.  Naša filozofia spočíva v rýchlej, čistej a odborné vykonanej rekonštrukcii, s dôrazom na detaily a udržovanie poriadku počas celého procesu.","Dobrý deň. Páči sa mi, že v Stavbach sa venujete rekonštrukcii bytov a poskytovaniu kvalitných služieb, ktoré prispievajú k zlepšeniu životného prostredia pre klientov."
COLOR MAL s.r.o.,COLOR,http://www.colormal.sk/,+421 919 359 561,Bratislava,Maliar,"COLOR MAL s.r.o. je spoločnosť zameraná na profesionálne maliarske práce, ktorá sa môže pochváliť dlhoročnými skúsenosťami v oblasti maľovania, stierkovania a tapetovania. S dôrazom na kvalitu a spoľahlivosť ponúkajú služby, ktoré sú prispôsobené požiadavkám klientov a zabezpečujú maximálnu spokojnosť s výsledkami práce. Vďaka bezplatnej obhliadke a rýchlej cenovej kalkulácii do 24 hodín majú zákazníci možnosť vybrať si z rôznych služieb s ohľadom na rozpočet a potreby.","Dobrý deň. Páči sa mi, že v COLOR sa venujete kvalite a precíznosti vo všetkých maliarskych prácach, čo sa odráža v pozitívnych referenciách vašich spokojných klientov. V súčasnej dobe hľadám odborníkov, ktorí dokážu zabezpečiť hladké a esteticky príjemné povrchy stien v mojom byte a vaša spoločnosť uznávaná za flexibilitu a profesionalitu ma oslovila."
SZAB STAV s.r.o.,SZAB,https://szabstav.sk/,+421 915 912 763,Zlatná na Ostrove,Stavebné služby,"Firma SZAB STAV s.r.o. bola založená v roku 2011 a špecializuje sa na poskytovanie širokého spektra stavebných služieb, medzi ktoré patrí rekonštrukcia a zateplenie rodinných a bytových domov, murárske, maliarske a zváracie práce. Spoločnosť sa neustále zameriava na zvyšovanie kvality a efektivity svojich služieb prostredníctvom odborných školení a výcvikov, pričom dbá na vyhovovanie aj najnáročnejším zákazníkom. Okrem odborného tímu vlastní aj licenciu na zhotovenie vonkajších tepelnoizolačných systémov ETICS.","Dobrý deň. Páči sa mi, že v SZAB sa venujete odbornému rozvoju a zvyšovaniu kvality vašich služieb, čo je nesmierne dôležité pre zachovanie konkurencieschopnosti na stavebnom trhu."
Vymaľujeme.to - MANAST s.r.o.,Vymaľujeme.to,https://www.vymalujeme.to/,+421 948 196 160,Devínska Nová Ves,Maliar,"Firma Vymaľujeme.to, pôsobiaca v Bratislave a okolí od roku 1993, sa špecializuje na kvalitné maľovanie interiérov a exteriérov vrátane airless striekania, rekonštrukcie bytov a montáže kazetových stropov. S dôrazom na profesionálny prístup, flexibilitu a individuálne požiadavky zákazníkov, ponúkajú komplexné služby s obhliadkou a cenovou ponukou zdarma, pričom zabezpečujú všetky potrebné materiály a dodržujú stanovené termíny. V ich portfóliu nájdete aj dekoratívne nátery a protiplesňové riešenia, čím sa snažia splniť aj tie najnáročnejšie požiadavky klientov.

Od rodinnej firmy s dlhoročnými skúsenosťami si môžete byť istí, že maľovanie vašich priestorov prebehne rýchlo a kvalitne. S radosťou prijímajú všetky zákazky, a to od malých bytov po rozsiahle priemyselné haly. Vďaka svojmu osobnému a dôslednému prístupu sa stali dôveryhodným partnerom v oblasti maliarskych prác pre množstvo spokojných zákazníkov v Bratislave a okolí.","Dobrý deň. Páči sa mi, že vo Vymaľujeme.to sa venujete komplexným riešeniam v oblasti maľovania a rekonštrukcie bytov a domov, čím poskytujete zákazníkom profesionálne služby s dôrazom na kvalitu a flexibilitu."
"STILLTECH, s. r. o.",STILLTECH,https://stilltech.sk/,+421 903 208 129,Ružindol,Stolárstvo,"STILLTECH, s. r. o. je renomovaná spoločnosť so sídlom v Ružindole, ktorá sa špecializuje na poskytovanie odborných služieb v oblasti stolárstva, stavebníctva a renovácií. S tímom skúsených remeselníkov sa zameriava na individuálne prispôsobené riešenia pre zákazníkov, pričom kladie dôraz na kvalitu, funkčnosť a estetiku každého projektu. Vďaka moderným technológiam a efektívnym postupom sa STILLTECH snaží zabezpečiť maximálnu spokojnosť svojich klientov a vytvorené dlhodobé a kvalitné produkty.","Dobrý deň. Páči sa mi, že v STILLTECH sa venujete širokému spektru služieb od výroby nábytku na mieru po komplexné stavebné a renovačné práce, čím sa snažíte naplniť rôzne potreby zákazníkov."
XéniArt,XéniArt,https://www.xeniart.eu/,+421 905 281 917,Čeláre,Maliar,"Spoločnosť XéniArt sa špecializuje na široké spektrum umeleckých a remeselných prác, ktoré zahŕňajú maľovanie interiérov, montáž sadrokartónu a pokládku obkladov a dlažieb. Vďaka viac než 20 ročnej praxi a odborným skúsenostiam ponúkajú kvalitné a trvácne riešenia, vrátane nadčasovej techniky maľovania fresiek, ktorá zaručuje unikátny estetiký vzhľad. 
Firma sa zameriava predovšetkým na Banskobystrický kraj, pričom jej referencie zahrnujú významné stavby v Taliansku, Maďarsku a Slovensku, čo svedčí o jej profesionalite a oddanosti remeslu. ","Dobrý deň. Páči sa mi, že v XéniArt sa venujete maľovaniu obrazov a dekorácií novou technikou fresiek, ktorá prispieva k nadčasovému a esteticky atraktívnemu vzhľadu interiérov. Vaša odbornosť a dlhoročné skúsenosti sú zaručením kvality a jedinečnosti každého projektu."
Janota Zdenko - MAĽOVANIE STIERKOVANIE,Janota Zdenko,,+421 908 926 795,Turany,,,
Azm s.r.o.,Azm,,+421 36/753 35 60,Štúrovo,,,
Sklenárstvo Mezei,Sklenárstvo Mezei,http://www.sklenarstvomezei.sk/,+421 910 983 644,Petržalka,Sklenár,"Sklenárstvo Mezei sa nachádza v Bratislave a ponúka široký sortiment sklenárskych služieb s dlhoročnými skúsenosťami. Medzi ich specialistické služby patrí zasklievanie okien a dverí, brúsenie, rezanie, fazetovanie skla a zrkadiel, ako aj montáž zrkadiel a izolačných dvojskiel.","Dobrý deň. Páči sa mi, že v Sklenárstvo Mezei sa venujete širokej ponuke sklenárskych služieb a kvalitnej práci, ktorú poskytujete svojim zákazníkom."
Sklenárstvo Čendo,Sklenárstvo Čendo,,+421 41/432 42 80,Čadca,Sklenár,,
Sklenárstvo - Peter Ložan,Sklenárstvo,http://www.sklenarstvo.sk/,+421 2/654 232 40,Karlova Ves,Sklenár,"Sklenárstvo Ložan je renomovaná spoločnosť so sídlom v Bratislave, ktorá ponúka rozsiahly predmet služieb v oblasti sklenárstva, vrátane zasklievania, brúsenia a rámovania. S dôrazom na kvalitu a rýchlosť poskytovaných služieb, sa stala dôveryhodným partnerom pre svojich zákazníkov v regióne Bratislavského kraja. Spoločnosť sa pýši dlhoročnými skúsenosťami a odborným zameraním, čím zabezpečuje vysoký štandard vo všetkých svojich aktivitách.","Dobrý deň. Páči sa mi, že v Sklenárstve Ložan sa venujete historickému vývoju skla a prehlbujete znalosti o tejto fascinujúcej tradícii. Je obdivuhodné, ako sa vaša firma zameriava na kvalitné služby v oblasti sklenárstva pri zachovaní dlhoročných skúseností."
Sklenárstvo Paulovič,Sklenárstvo Paulovič,,+421 908 154 045,Nové Zámky,Obchod so sklom a zrkadlami,,
SKLENÁRSTVO - Jaroslav Babušiak,SKLENÁRSTVO,http://www.sklenarstvodk.sk/,+421 44/432 35 41,Ružomberok,Sklenár,"Sklenárstvo Jaroslav Babušiak je rodinná firma s viac ako 30-ročnou tradíciou, ktorá sa zameriava na poskytovanie kvalitných sklenárskych služieb a produktov. Sídlo spoločnosti sa nachádza v Dolnom Kubíne a ponúka široké spektrum výrobkov, ako sú sprchové kúty, zrkadlá, sklenené zábradlia a kuchynské zásteny, pričom kladie dôraz na precíznosť a spokojnosť zákazníka. Firma sa neustále snaží inovovať a zhmotňovať predstavy svojich klientov pomocou skla, pričom každému projektu pristupuje individuálne, aby splnila ich špecifické požiadavky a priania.","Dobrý deň. Páči sa mi, že v Sklenárstve Jaroslav Babušiak sa venujete profesionálnym sklenárskym službám a ponúkate široký sortiment produktov, ktoré spájajú kvalitu s eleganciou a moderným dizajnom."
Sklenárstvo LEON,Sklenárstvo LEON,,+421 914 151 818,Galanta,Sklenár,,
Sklenárstvo Sklokomplet S.r.o.,Sklenárstvo Sklokomplet,,+421 51/452 00 50,Prešov,Sklenár,,
Sklenárstvo - Sedlárik,Sklenárstvo,,+421 2/459 235 23,Senec,Sklenár,,
Aja Sklenárstvo - Jaško Ján,AJA,,+421 908 430 670,Nové Mesto nad Váhom,Sklenár,,
Sklofix - Sklenárstvo Bratislava,Sklofix,https://www.sklofix.sk/,+421 903 818 471,Bratislava,Výrobca skla,"Sklofix je popredné sklenárstvo pôsobiace v Bratislave a Trnave, ktoré sa špecializuje na výrobu sklenených produktov na mieru. S viac než 20-ročnou tradíciou na trhu ponúka široké spektrum služieb, od sklenených zábradlí po hliníkové okná, pričom zabezpečuje produkty v prvotriednej kvalite za najnižšie ceny. ","Dobrý deň. Páči sa mi, že v Sklofix sa venujete výrobe kvalitných sklenených produktov na mieru, čo prispieva k modernému dizajnu a funkčnosti interiérov."
Sklenárstvo MIER,Sklenárstvo MIER,https://www.sklenarstvomier.sk/,+421 948 177 924,Spišská Nová Ves,Sklenár,"Sklenárstvo MIER je renomovaná firma so sídlom v Spišskej Novej Vsi, ktorá sa špecializuje na výrobu a montáž sklenených produktov na mieru. S dlhoročnými skúsenosťami v tomto odvetví ponúkajú kvalitné služby, ktoré zahŕňajú kuchynské zásteny, sprchovacie kúty, sklenené priečky, zrkadlá a ďalšie atypické sklenené riešenia. Ich prístup je založený na profesionalite, precíznom spracovaní a ústretovosti voči zákazníkovým potrebám, čo dokazujú aj spokojní klienti s množstvom úspešne realizovaných projektov.","Dobrý deň. Páči sa mi, že v Sklenárstvo MIER sa venujete širokej škále sklenárskych služieb a kladiete dôraz na kvalitu a profesionalitu pri realizácii projektov na mieru."
SKLENÁRSTVO K + K SKLOLOM,SKLENÁRSTVO K + K SKLOLOM,,+421 44/522 17 45,Liptovský Hrádok,Sklenár,,
"Sklenárstvo, Rámovanie - Marta Poláčková","Sklenárstvo, Rámovanie",http://sklenarstvoramovaniepolackova.mojanitra.sk/,+421 37/652 58 33,Nitra,Opravovňa skla,"Sklenárstvo a rámovanie obrazov Marta Poláčková v Nitre je renomovaná firma, ktorá pôsobí na trhu od roku 1990. Počas svojej existencie si vybudovala stabilnú pozíciu a dôveru u tisícov spokojných zákazníkov, ktorých priority predurčujú kvalitu a ochotu poradiť. Neustále sa snažíme skvalitňovať naše služby, aby sme splnili aj najnáročnejšie požiadavky klientov.
Naša ponuka zahŕňa široký rozsah služieb vrátane zasklievania okien, rezania a brúsenia zrkadiel, a rámovania obrazov s možnosťou výberu z množstva rôznych dizajnov a materiálov. Sme presvedčení, že s našou odbornou pomocou a profesionálnym prístupom odídete spokojní a radi sa k nám vrátite.","Dobrý deň. Páči sa mi, že v Sklenárstvo a rámovanie obrazov Marta Poláčková sa venujete kvalite a spokojnosti zákazníkov, čo je v súčasnej dobe veľmi cenné."
Sklenárstvo - Tibor Vajner,Sklenárstvo,http://www.vajner.sk/,+421 903 232 003,Bratislava,Obchod so sklom a zrkadlami,"Sklenárstvo Vajner je dynamická firma so sídlom v Bratislave, ktorá sa na slovenskom trhu etablovala už takmer desať rokov. Svojím zákazníkom ponúka širokú škálu kvalitných služieb, vrátane zasklievania, rezania a brúsenia skla, pričom sa môže pochváliť dlhoročnou praxou a odbornými znalosťami svojich zamestnancov. Medzi významných klientov patrí aj obchodný reťazec Tesco a prestížne obchodné centrá ako Aupark či Polus City Center, čo svedčí o ich profesionalite a kvalite vykonávaných prác.
Sklenárstvo Vajner si zachováva osobitný prístup k zákazníkom, pričom sa snaží vyhovieť individuálnym potrebám každého z nich. V rámci svojich služieb tiež ponúkajú odborné poradenstvo a dôraz na detaily, čo robí ich produktmi a službami výnimočnými. Ich unikátna ponuka zahŕňa aj služby ako lepenie akvárii a pieskovanie, pričom ako jediní na Slovensku ponúkajú brúsenie obrazcov do skla. Vďaka ľahkej dostupnosti a možnosti dopravy zakúpeného tovaru priamo k zákazníkovi predstavuje Sklenárstvo Vajner ideálny výber pre každého, kto hľadá profesionálne sklenárske služby v Bratislave.","Dobrý deň. Páči sa mi, že v Sklenárstvo Vajner sa venujete personalizovanému prístupu k zákazníkom a kvalite vašich služieb."
Sklenárstvo - Korenačka,Sklenárstvo,http://www.flim.sk/,+421 905 797 151,Partizánske,Sklenár,"Sklenárstvo je renomovaná firma, ktorá sa špecializuje na výrobné a opravárenské práce v oblasti skla. Naším cieľom je poskytovať zákazníkom služby najvyššej kvality a zabezpečiť ich plnú spokojnosť s finálnymi produktmi, či už ide o jednoduché opravy alebo zložitú výrobu sklenených prvkov. Naši odborníci používajú moderné technológie a prístroje pre zabezpečenie precíznosti a efektivity vo všetkých fázach výroby a montáže. 
Sledujeme aktuálne trendy v odvetví a neustále sa vzdelávame, aby sme zákazníkom prinesli inovatívne a funkčné riešenia. Naša práca je postavená na kvalitných materiáloch a zameriava sa na detail, čo nám umožňuje dosiahnuť vynikajúce výsledky a dlhodobú trvácnosť našich výrobkov.","Dobrý deň. Páči sa mi, že v Sklenárstvo sa venujete precíznemu a detailnému spracovaniu skla, čo odráža váš záväzok kvality a inovácií vo všetkých vašich projektoch."
Sklenárstvo - Rámovanie Obrazov,Sklenárstvo,,+421 915 421 640,Partizánske,,,
